impound_no,Animal_ID,Data_Source,Record_Type,Link,location,name,animal_type,Age,Animal_Gender,breed,Animal_Color,Date,Date_Type,Obfuscated_Address,City,State,Zip,jurisdiction,obfuscated_latitude,obfuscated_longitude,picture,image_alt_text,Description ,Temperament
K19-117062,A584652,Regional Animal Services of King County,FOUND,https://petharbor.com/PublicDetail.asp?searchtype=PUBFOUND&view=sysadm.v_animal&shelterlist='KING'&where=type&ID=1988666,In Public Home,,Dog,Over 1 year,Female,Labrador Retriever,Black,05/10/2019 12:00:00 AM,Date Found,13500 121ST AVE NE,KIRKLAND,WA,98034,KIRKLAND,,,https://petharbor.com/get_image.asp?RES=Detail&LOCATION=PUBLIC&ID=1988666,Image Copyright HLP Inc. 2019,Description: Very friendly.<p/>Grey hairs.<p/>Poor front teeth.<p/>Age: Over 1 year<p/>Location Found: 13517 121ST AVE NE<p/>Notes: <p/>Found Date: 05/10/2019<p/>Finder Address:  Kirkland wa WA 98034,
K14-076951,A449967,Regional Animal Services of King County,ADOPTABLE,https://kingcounty.gov/depts/regional-animal-services/about-us/overview.aspx,In RASKC Foster Home,Penny,Cat,10 YEARS 6 MONTHS,Spayed Female,Domestic Shorthair,Calico,11/02/2014 12:00:00 AM,Received on,21615 64TH AVE S,KENT,WA,98032,KENT,47.407788,-122.255197,https://petharbor.com/get_image.asp?RES=Detail&LOCATION=KING&ID=A449967,Image Copyright HLP Inc. 2019,Received on: 2014-11-02<p/> Description: Calico Spayed Female Domestic Shorthair Cat<p/> Age: 10 YEARS 6 MONTHS<p/> Adoption Fee: $30.00<p/> Current Location: In RASKC Foster Home <p/><p/>,
K17-102943,A538943,Regional Animal Services of King County,ADOPTABLE,https://kingcounty.gov/depts/regional-animal-services/about-us/overview.aspx,In RASKC Foster Home,Anastasia,Cat,9 YEARS 7 MONTHS,Spayed Female,Domestic Longhair,Black,09/17/2017 12:00:00 AM,Received on,21615 64TH AVE S,KENT,WA,98032,KENT,47.407788,-122.255197,https://petharbor.com/get_image.asp?RES=Detail&LOCATION=KING&ID=A538943,Image Copyright HLP Inc. 2019,"Received on: 2017-09-17<p/> Description: Black Spayed Female Domestic Longhair Cat<p/> Age: 9 YEARS 7 MONTHS<p/> Adoption Fee: $30.00<p/> Current Location: In RASKC Foster Home <p/>Hi! My name is Anastasia and I am available for adoption.<p/><p/>I was brought in by a good samaritan on September 17, 2017.<p/><p/>I am an independent kitty who likes to do my own thing! I like getting attention on my own terms. I can get overstimulated with petting, so please move carefully with me and keep an eye out for signs that I might need a break.<p/><p/>My caregivers have noticed that I do not seem to get along with other cats, so I may do best as the only cat in my new home.<p/><p/>My personality color is GREEN. I am an adaptable cat who loves to go with the flow! I am outgoing and carefree, and I just can't wait to find my forever home!<p/><p/>A veterinarian has diagnosed or tentatively diagnosed the above-described pet with the following condition(s):<p/><p/>1)   Renal disease.  Anastasia has been documented to have renal insufficiency characterized by increased renal values and the inability to concentrate urine.  She has increase thirst and increased urine production.  Renal disease is generally progressive and must be managed to maintain a good quality of life.  Your veterinarian may recommend additional testing, medications, prescription diets, or supplemental care as needed.<p/><p/>2)  Old fracture of left femoral head and left ilium.  Spondylosis in thoracolumbar area.  She has had some stiffness in the hind end.  These chronic changes can be managed with pain medication and joint supplements.  Treatment is focused on lifelong management of the disease, rather than a cure.  Treatment may include weight loss plans, daily medications, nutritional supplements or regular, moderate exercise.  Please follow up with your regular veterinarian.<p/><p/>3)  Radiographic evidence of bronchopulmonary disease/asthma.  No respiratoyr signs have been noted but she may need treatment in the future.<p/><p/>As a result of these conditions, your pet may need specialized care consisting of any or all of the below.  Please note this is not intended to be an exhaustive list.<p/><p/>- Special diet or prescription foods<p/>- Prescription or over-the-counter medicines<p/>- Special skin care or shampoos<p/>- Regular veterinarian visits, which may include blood tests or other monitoring<p/>- Possible surgery or other procedures as determined by your veterinarian<p/><p/>",
K17-104325,A533907,Regional Animal Services of King County,ADOPTABLE,https://kingcounty.gov/depts/regional-animal-services/about-us/overview.aspx,In RASKC Foster Home,Hera,Cat,11 YEARS -1 MONTHS,Spayed Female,Domestic Shorthair,Calico,10/28/2017 12:00:00 AM,Received on,21615 64TH AVE S,KENT,WA,98032,SEATTLE,47.407788,-122.255197,https://petharbor.com/get_image.asp?RES=Detail&LOCATION=KING&ID=A533907,Image Copyright HLP Inc. 2019,"Received on: 2017-10-28<p/> Description: Calico Spayed Female Domestic Shorthair Cat<p/> Age: 11 YEARS -1 MONTHS<p/> Adoption Fee: An Adoption Fee has not been set. Please inquire with the shelter.<p/> Current Location: In RASKC Foster Home <p/>My name is Hera and I am an 11 year old calico, short haired, spayed female cat. I ended up at the shelter through no fault of my own and now I am looking for a forever home.<p/><p/>I am a very sweet and friendly girl.  I love, love, love attention and will come to seek you out.  I get along well with other cats, even when they get in my face, I still stay chill. I love to be petted and brushed too.<p/><p/>I am litterbox trained, have all my vaccinations and I'm microchipped, so I will not get lost again.  I am an easy going girl who really just wants to find my forever friend.  Please come to see me, you won't be disappointed.<p/><p/>A veterinarian has diagnosed or tentatively diagnosed the above-described pet with the following condition(s):<p/><p/>1)     Hera has been diagnosed with hyperthyroidism; excess production of thyroid hormone.  Hyperthyroidism can cause weight loss, vocalization, increased urine production and heart disease.  This condition is being managed with daily medication.  Other treatment options may be available, including radioactive iodine treatment or prescription diet.  Periodic blood testing to monitor thyroid levels is needed.  Please follow up with you regular veterinarian to create a treatment plan.  An educational handout is provided.<p/><p/>2)     Hera has had mild recurring upper respiratory infections.<p/><p/><p/>As a result of these conditions, your pet may need specialized care consisting of any or all of the below.  Please note this is not intended to be an exhaustive list.<p/><p/>- Special diet or prescription foods<p/>- Prescription or over-the-counter medicines<p/>- Special skin care or shampoos<p/>- Regular veterinarian visits, which may include blood tests or other monitoring<p/>- Possible surgery or other procedures as determined by your veterinarian<p/><p/>",
K17-105331,A547918,Regional Animal Services of King County,ADOPTABLE,https://kingcounty.gov/depts/regional-animal-services/about-us/overview.aspx,In RASKC Foster Home,Babette,Cat,18 YEARS 5 MONTHS,Spayed Female,Domestic Shorthair,Brn Tabby,12/04/2017 12:00:00 AM,Received on,21615 64TH AVE S,KENT,WA,98032,KING COUNTY,47.407788,-122.255197,https://petharbor.com/get_image.asp?RES=Detail&LOCATION=KING&ID=A547918,Image Copyright HLP Inc. 2019,"Received on: 2017-12-04<p/> Description: Brn Tabby Spayed Female Domestic Shorthair Cat<p/> Age: 18 YEARS 5 MONTHS<p/> Adoption Fee: $30.00<p/> Current Location: In RASKC Foster Home <p/>Hi! My name is Babette and I am available for adoption.<p/><p/>I was brought in by my previous owner on 12/5/17 because the landlord didn't allow cats. I lived in a home with dogs but the were not my favorite. I also lived with other cats and children. My previous owner described me as calm and vocal.<p/><p/>I like getting attention on my own terms. I can get overstimulated with petting, so please move carefully with me and keep an eye out for signs that I might need a break.<p/><p/>Because of my shy nature, I would do best in a calm, quiet home.<p/><p/>My personality color is BLUE. I am a gentle and loving cat who likes to take things slow. I may get nervous in new situations, so I am looking for a family who understands that I might need some time to warm up. Once I get to know you, I will be a very devoted friend!<p/><p/>A veterinarian has diagnosed or tentatively diagnosed the above-described pet with the following condition(s):<p/><p/>1)     This animal has been diagnosed as hyperthyroid.  This means that thyroid gland is producing an excess of hormones.  This disease can be easily managed with daily medication, radioactive iodine treatment or prescription diet.  Please follow up with you regular veterinarian to create a treatment plan.  We have also included a handout with more information about this disease.<p/><p/>2)  This animal has been diagnosed with early kidney disease.  This condition can be managed with special diets and medications.  Treatment will be lifelong.  Please follow up with your regular veterinarian for the best treatment plan.  <p/><p/><p/>As a result of these conditions, your pet may need specialized care consisting of any or all of the below.  Please note this is not intended to be an exhaustive list.<p/><p/>- Special diet or prescription foods<p/>- Prescription or over-the-counter medicines<p/>- Special skin care or shampoos<p/>- Regular veterinarian visits, which may include blood tests or other monitoring<p/>- Possible surgery or other procedures as determined by your veterinarian<p/><p/><p/>",BLUE
K18-106401,A551273,Regional Animal Services of King County,ADOPTABLE,https://kingcounty.gov/depts/regional-animal-services/about-us/overview.aspx,In RASKC Foster Home,Midnight,Cat,13 YEARS 3 MONTHS,Spayed Female,Domestic Shorthair,Black,02/03/2018 12:00:00 AM,Received on,21615 64TH AVE S,KENT,WA,98032,KING COUNTY,47.407788,-122.255197,https://petharbor.com/get_image.asp?RES=Detail&LOCATION=KING&ID=A551273,Image Copyright HLP Inc. 2019,"Received on: 2018-02-03<p/> Description: Black Spayed Female Domestic Shorthair Cat<p/> Age: 13 YEARS 3 MONTHS<p/> Adoption Fee: $30.00<p/> Current Location: In RASKC Foster Home <p/>Hi! My name is Midnight and I am available for adoption.<p/><p/>I was brought in by my previous owner on  2/3/18.<p/><p/><p/>My personality color is GREEN. I am an adaptable cat who loves to go with the flow! I am outgoing and carefree, and I just can't wait to find my forever home!<p/><p/>I am an affectionate lovebug who would be thrilled to cuddle up with you at home!<p/><p/><p/>My caregivers have noticed that I seem to do well with other cats. When meeting cats in a new home, I would do best with a slow introduction.<p/><p/><p/><p/><p/>",GREEN
K18-109705,A561461,Regional Animal Services of King County,ADOPTABLE,https://kingcounty.gov/depts/regional-animal-services/about-us/overview.aspx,In RASKC Foster Home,Baby Girl,Cat,14 YEARS 10 MONTHS,Spayed Female,Domestic Shorthair,Seal Pt,06/26/2018 12:00:00 AM,Received on,21615 64TH AVE S,KENT,WA,98032,COVINGTON,47.407788,-122.255197,https://petharbor.com/get_image.asp?RES=Detail&LOCATION=KING&ID=A561461,Image Copyright HLP Inc. 2019,"Received on: 2018-06-26<p/> Description: Seal Pt Spayed Female Domestic Shorthair Cat<p/> Age: 14 YEARS 10 MONTHS<p/> Adoption Fee: $30.00<p/> Current Location: In RASKC Foster Home <p/>Hi! My name is Baby Girl and I am available for adoption.<p/><p/>I was brought in by my previous owner on 6/26/18 because they couldnt take care of me anymore. My previous owner described me as friendly, active, playful and vocal.<p/><p/>I do love to talk! I would love to tell you all about how my day is going!<p/>I am an affectionate lovebug who would be thrilled to cuddle up with you at home!<p/><p/>My personality color is GREEN. I am an adaptable cat who loves to go with the flow! I am outgoing and carefree, and I just can't wait to find my forever home!<p/><p/><p/>",GREEN
K18-110899,A564655,Regional Animal Services of King County,ADOPTABLE,https://kingcounty.gov/depts/regional-animal-services/about-us/overview.aspx,In RASKC Foster Home,Checkers,Cat,14 YEARS 9 MONTHS,Spayed Female,Domestic Shorthair,Black / White,08/02/2018 12:00:00 AM,Received on,21615 64TH AVE S,KENT,WA,98032,KING COUNTY,47.407788,-122.255197,https://petharbor.com/get_image.asp?RES=Detail&LOCATION=KING&ID=A564655,Image Copyright HLP Inc. 2019,"Received on: 2018-08-02<p/> Description: Black / White Spayed Female Domestic Shorthair Cat<p/> Age: 14 YEARS 9 MONTHS<p/> Adoption Fee: $30.00<p/> Current Location: In RASKC Foster Home <p/>Hi! My name is Checkers and I am available for adoption.<p/><p/>I was brought in by my previous owner on August 2nd, 2018 because they were moving and could not keep me. My previous owner described me as friendly and sweet. They also said that I like to hang out in windows and watch birds, lay on your lap and that I'm not a big fan of being picked up. <p/><p/>My personality color is red.  I enjoy getting pets on the head most and I like sitting on your lap after I get to know you!  <p/><p/>My caregivers have noticed I do not like other cats.  I prefer to be the only princess in the house!<p/><p/>",RED
K18-111651,A566749,Regional Animal Services of King County,ADOPTABLE,https://kingcounty.gov/depts/regional-animal-services/about-us/overview.aspx,In RASKC Foster Home,Rosie,Cat,13 YEARS 8 MONTHS,Female,Domestic Shorthair,Calico / Tortie,08/27/2018 12:00:00 AM,Received on,21615 64TH AVE S,KENT,WA,98032,KENT,47.407788,-122.255197,https://petharbor.com/get_image.asp?RES=Detail&LOCATION=KING&ID=A566749,Image Copyright HLP Inc. 2019,"Received on: 2018-08-27<p/> Description: Calico / Tortie Female Domestic Shorthair Cat<p/> Age: 13 YEARS 8 MONTHS<p/> Adoption Fee: $30.0<p/> Current Location: In RASKC Foster Home <p/>Hi! My name is Rosie and I am available for adoption.<p/><p/>I was brought in by a good samaritan on 8/27/18.<p/><p/>My personality color is GREEN. I am an adaptable cat who loves to go with the flow! I am outgoing and carefree, and I just can't wait to find my forever home!<p/><p/>I am an affectionate lovebug who would be thrilled to cuddle up with you at home!<p/><p/><p/>",GREEN
K19-114789,A578201,Regional Animal Services of King County,ADOPTABLE,https://kingcounty.gov/depts/regional-animal-services/about-us/overview.aspx,In RASKC Foster Home,Karl,Cat,12 YEARS 3 MONTHS,Male,Domestic Longhair,Brn Tabby,01/11/2019 12:00:00 AM,Received on,21615 64TH AVE S,KENT,WA,98032,TUKWILA,47.407788,-122.255197,https://petharbor.com/get_image.asp?RES=Detail&LOCATION=KING&ID=A578201,Image Copyright HLP Inc. 2019,"Received on: 2019-01-11<p/> Description: Brn Tabby Male Domestic Longhair Cat<p/> Age: 12 YEARS 3 MONTHS<p/> Adoption Fee: An Adoption Fee has not been set. Please inquire with the shelter.<p/> Current Location: In RASKC Foster Home <p/>Karl is a big guy with a matching cattitude. He would be best as the only pet in the house unless he could get a proper (and long) introduction, as he thinks he is the alpha male. In foster care he tolerates three other cats that are all submissive. He was traumatized by the death of his owner when he was brought in to RASKC, and after two months in foster care he has settled down quite a bit. Sometimes he will jump up on your lap, headbutt you and purr, and a few minutes later hiss and jump down. At this time he needs a forever home with lots of attention so he can settle into being a happy cat all of the time. Note that it has taken several weeks to get to where he is now and will likely regress some when he moves. It will require some patience but it will be well worth it as he can be a big, loving and cuddly kitty. He'll even sleep under the covers with you.<p/><p/>Karl is not a picky eater and is 100% when it comes to the litter box. He marks his ""territory"" with a headbutt only and does not spray (whew!). He loves his cardboard scratching post and is absolutely crazy about catnip and his catnip banana. A laser pointer is a must as is a feather on a string for play. He is an exclusively inside cat but does like to spend some time in the catio to get away.<p/><p/>You can meet Karl at his foster home and have any of your questions answered.<p/>",RED
K19-115007,A578798,Regional Animal Services of King County,ADOPTABLE,https://kingcounty.gov/depts/regional-animal-services/about-us/overview.aspx,In RASKC Foster Home,Mcgonagall,Cat,9 MONTHS,Spayed Female,Domestic Shorthair,Brn Tabby / White,01/22/2019 12:00:00 AM,Received on,21615 64TH AVE S,KENT,WA,98032,KING COUNTY,47.407788,-122.255197,https://petharbor.com/get_image.asp?RES=Detail&LOCATION=KING&ID=A578798,Image Copyright HLP Inc. 2019,"Received on: 2019-01-22<p/> Description: Brn Tabby / White Spayed Female Domestic Shorthair Cat<p/> Age: 9 MONTHS<p/> Adoption Fee: An Adoption Fee has not been set. Please inquire with the shelter.<p/> Current Location: In RASKC Foster Home <p/>Hi! My name is McGonagall and I am available for adoption.<p/><p/>I was brought in by a good samaritan on January 22, 2019.<p/><p/>Hi there, I'm what you would call an undersocialized kitten. It doesn't mean anything bad it just means when I was wee little one, I was not taught about how nice and awesome people can be to me. I'm very scared at first but once you take the time to show me I can trust you, I will melt in your arms. Although, I'm a fearful kitty, I actually really love to snuggle and purr! I would love to go to a home with with a young, confident kitty friend! <p/><p/>My personality color is BLUE. I am a gentle and loving cat who likes to take things slow. I may get nervous in new situations, so I am looking for a family who understands that I might need some time to warm up. Once I get to know you, I will be a very devoted friend!<p/><p/><p/>",BLUE
K19-115394,A574900,Regional Animal Services of King County,ADOPTABLE,https://kingcounty.gov/depts/regional-animal-services/about-us/overview.aspx,In RASKC Foster Home,Ember,Cat,12 YEARS 5 MONTHS,Neutered Male,Domestic Shorthair,Gray / White,02/16/2019 12:00:00 AM,Received on,21615 64TH AVE S,KENT,WA,98032,KENT,47.407788,-122.255197,https://petharbor.com/get_image.asp?RES=Detail&LOCATION=KING&ID=A574900,Image Copyright HLP Inc. 2019,"Received on: 2019-02-16<p/> Description: Gray / White Neutered Male Domestic Shorthair Cat<p/> Age: 12 YEARS 5 MONTHS<p/> Adoption Fee: $30.00<p/> Current Location: In RASKC Foster Home <p/>Hi! My name is Ember and I am available for adoption.<p/><p/>I was brought in by a good samaritan on 11/16/18.<p/><p/>My personality color is GREEN. I am an adaptable cat who loves to go with the flow! I am outgoing and carefree, and I just can't wait to find my forever home!<p/><p/>I am an affectionate lovebug who would be thrilled to cuddle up with you at home!<p/><p/>My caregivers have noticed that I seem to do well with other cats. When meeting cats in a new home, I would do best with a slow introduction.<p/><p/>",GREEN
K19-115456,A579958,Regional Animal Services of King County,ADOPTABLE,https://kingcounty.gov/depts/regional-animal-services/about-us/overview.aspx,In RASKC Foster Home,Brina,Cat,12 YEARS 2 MONTHS,Spayed Female,Domestic Shorthair,Calico,02/20/2019 12:00:00 AM,Received on,21615 64TH AVE S,KENT,WA,98032,KING COUNTY,47.407788,-122.255197,https://petharbor.com/get_image.asp?RES=Detail&LOCATION=KING&ID=A579958,Image Copyright HLP Inc. 2019,"Received on: 2019-02-20<p/> Description: Calico Spayed Female Domestic Shorthair Cat<p/> Age: 12 YEARS 2 MONTHS<p/> Adoption Fee: $30.00<p/> Current Location: In RASKC Foster Home <p/>Hi! My name is Brina and I am available for adoption.<p/><p/>I was brought in by a good samaritan on 02/20/19.<p/><p/>My personality color is BLUE. I am a gentle and loving cat who likes to take things slow. I may get nervous in new situations, so I am looking for a family who understands that I might need some time to warm up. Once I get to know you, I will be a very devoted friend!<p/><p/>",BLUE
K19-115473,A564257,Regional Animal Services of King County,ADOPTABLE,https://petharbor.com/pet.asp?uaid=KING.A564257,"King County Pet Adoption Center 21615 64TH AVE S KENT, WA 98032",Buster,Dog,4 YEARS 9 MONTHS,Neutered Male,Pit Bull / Mix,Br Brindle / White,02/21/2019 12:00:00 AM,Received on,,,,,,,,https://petharbor.com/get_image.asp?RES=Detail&LOCATION=KING&ID=A564257,Image Copyright HLP Inc. 2019,"Received on: 2019-02-21<p/> Description: Br Brindle / White<p/>  Neutered Male Pit Bull / Mix Dog<p/> Age: 4 YEARS 9 MONTHS<p/> Adoption Fee: $100.00<p/> Current Location: King County Pet Adoption Center 21615 64TH AVE S KENT, WA 98032<p/>Hi! My name is Buster and I am available for adoption. I was brought in by my previous owner on 2/21/19 because I did not enjoy living with another dog. <p/><p/>I am an energetic guy who would love to be your hiking partner! I would also make a great cuddle buddy and I just adore belly rubs! I love my favorite people so much that I sometimes display separation anxiety, but I do feel safe if kept crated when I'm left alone.<p/><p/>I am a very smart dog and I already know ""sit,"" ""stay,"" ""come,"" ""down"" and ""shake."" I am still working on my manners, so I would so best with a family who can work with me and help me become the best dog I can be. <p/><p/>My caregivers have observed that I might not get along with other dogs. I may do best as the only dog in my new home, or need to meet other dogs in the home first. I also may do best in a home without children.<p/><p/>My personality color is RED, meaning I am a spirited dog with a fun-loving personality! I am still working on my manners, so I would do best with a family who is willing to work with me and help me become the best dog I can be!<p/>",RED
K19-115825,A581133,Regional Animal Services of King County,ADOPTABLE,https://petharbor.com/pet.asp?uaid=KING.A581133,"King County Pet Adoption Center 21615 64TH AVE S KENT, WA 98032",Annie,Dog,3 YEARS 1 MONTH,Spayed Female,Chinese Sharpei / Pit Bull,Br Brindle,03/14/2019 12:00:00 AM,Received on,,,,,,,,https://petharbor.com/get_image.asp?RES=Detail&LOCATION=KING&ID=A581133,Image Copyright HLP Inc. 2019,"Received on: 2019-03-14<p/> Description: Br Brindle<p/>  Spayed Female Chinese Sharpei / Pit Bull Dog<p/> Age: 3 YEARS 1 MONTH<p/> Adoption Fee: $100.00<p/> Current Location: King County Pet Adoption Center 21615 64TH AVE S KENT, WA 98032<p/>Hi! My name is Annie and I am available for adoption.<p/><p/>I was brought in by an Animal Control Officer on March 14, 2019.<p/><p/>I was a little nervous when I first arrived at the shelter, but my caregivers took some time with me and showed me how much they cared about me and I opened right up! They love to snuggle me cause of my velvet soft fur!<p/><p/>Once I warm up, I am an affectionate lovebug who would be thrilled to cuddle up with you at home!<p/><p/>My caregivers have observed that I might not get along with all other dogs and do best with dogs that are respectful. I may do best as the only dog in my new home, or need to meet other dogs in the home first.<p/><p/>Because of my shy nature, I would do best in a calm, quiet home with older children.<p/><p/>My personality color is BLUE. I am a gentle and loving dog who likes to take things slow. I may get nervous in new situations, so I am looking for a family who understands that I might take some time to warm up. Once I get to know you, I will be a very devoted friend!<p/>",BLUE
K19-115825,A581133,Regional Animal Services of King County,FOUND,https://petharbor.com/pet.asp?uaid=KING.A581133,"King County Pet Adoption Center 21615 64TH AVE S KENT, WA 98032",Annie,Dog,3 YEARS 1 MONTH,Spayed Female,Chinese Sharpei / Pit Bull,Br Brindle,03/14/2019 12:00:00 AM,Received on,17000 220TH PL NE,WOODINVILLE,WA,98077,KING COUNTY,47.751173,-122.044442,https://petharbor.com/get_image.asp?RES=Detail&LOCATION=KING&ID=A581133,Image Copyright HLP Inc. 2019,"Received on: 2019-03-14<p/> Found Near: 17000 220TH PL NE, WOODINVILLE WA 98077<p/> Description: Br Brindle Spayed Female Chinese Sharpei / Pit Bull Dog<p/> Age: 3 YEARS 1 MONTH<p/> Current Location: King County Pet Adoption Center 21615 64TH AVE S KENT, WA 98032<p/>",BLUE
K19-115994,A577657,Regional Animal Services of King County,ADOPTABLE,https://petharbor.com/pet.asp?uaid=KING.A577657,"King County Pet Adoption Center 21615 64TH AVE S KENT, WA 98032",Franco,Dog,6 YEARS 4 MONTHS,Neutered Male,American Bulldog / Mix,Tan / White,03/22/2019 12:00:00 AM,Received on,,,,,,,,https://petharbor.com/get_image.asp?RES=Detail&LOCATION=KING&ID=A577657,Image Copyright HLP Inc. 2019,"Received on: 2019-03-22<p/> Description: Tan / White<p/>  Neutered Male American Bulldog / Mix Dog<p/> Age: 6 YEARS 4 MONTHS<p/> Adoption Fee: $100.00<p/> Current Location: King County Pet Adoption Center 21615 64TH AVE S KENT, WA 98032<p/>Hi! My name is Franco and I am available for adoption.<p/><p/>I was brought in by my previous adopter on March 22, 2019 because I was not a good fit for a home with cats. My previous owner described me as happy and affectionate! They said I liked long walks and snuggling on the couch, but I can also be stubborn sometimes.<p/><p/>I am an affectionate lovebug who would be thrilled to cuddle up with you at home!<p/><p/>I am full of energy and I love to play! I tend to calm down more when the people around me stay calm. I do best when I have lots of exercise and something to keep my mind busy.<p/><p/>My personality color is RED. I am a spirited dog with a fun-loving personality! I am still working on my manners, so I would do best with a family who is willing to work with me and help me become the best dog I can be!<p/>",RED
K19-116317,A497023,Regional Animal Services of King County,ADOPTABLE,https://petharbor.com/pet.asp?uaid=KING.A497023,"Kirkland Petco 12040 NE 85TH ST KIRKLAND, WA 98033",Sasha,Cat,8 YEARS 10 MONTHS,Spayed Female,Domestic Longhair,Tortie / Gray,04/06/2019 12:00:00 AM,Received on,12040 NE 85TH ST,KIRKLAND,WA,98033,KIRKLAND,47.680519,-122.179195,https://petharbor.com/get_image.asp?RES=Detail&LOCATION=KING&ID=A497023,Image Copyright HLP Inc. 2019,"Received on: 2019-04-06<p/> Description: Tortie / Gray<p/>  Spayed Female Domestic Longhair Cat<p/> Age: 8 YEARS 10 MONTHS<p/> Adoption Fee: $30.00<p/> Current Location: Kirkland Petco 12040 NE 85TH ST KIRKLAND, WA 98033<p/>Hi! My name is Sasha and I am available for adoption. I was brought in by my previous owner on 4/6/19.  They said I am a sweet cat that likes to be petted and get belly rubs.<p/><p/>My caregivers have noticed that I do not seem to get along with other cats. I may do best as the only pet in the home. <p/><p/>I can be picky about my litter box and I prefer to have wheat litter in an extra large litter box with high sides. I also prefer to have my litter box in a quiet area with daily cleaning. I do best when I do not have the opportunity to soil on piles of laundry or towels on the floor, so it would be best to limit my access to these things in my new home. <p/><p/>My personality color is RED. I am an affectionate cat with a fun-loving personality!  I enjoy getting attention, but I can get overstimulated, so please look for signs that I am done being petted.  I love having a cat tree to sit on and watch the day go by.<p/>",RED
K19-116372,A582522,Regional Animal Services of King County,ADOPTABLE,https://petharbor.com/pet.asp?uaid=KING.A582522,"King County Pet Adoption Center 21615 64TH AVE S KENT, WA 98032",Big Bertha,Cat,3 YEARS,Spayed Female,Domestic Longhair,Black,04/08/2019 12:00:00 AM,Received on,,,,,,,,https://petharbor.com/get_image.asp?RES=Detail&LOCATION=KING&ID=A582522,Image Copyright HLP Inc. 2019,"Received on: 2019-04-08<p/> Description: Black<p/>  Spayed Female Domestic Longhair Cat<p/> Age: 3 YEARS<p/> Adoption Fee: $30.00<p/> Current Location: King County Pet Adoption Center 21615 64TH AVE S KENT, WA 98032<p/>Hi! My name is Bertha and I am available for adoption.<p/><p/>I was brought in by a good samaritan on April 8, 2019. <p/><p/>I am an incredibly sweet cat who loves attention! I'm playful and active and I love to jump around!  I also love being groomed and getting brushed. I'm just an overall sweet cat!  I came into the shelter with a bad wound on my back end so I'm still healing. You will notice my bad haircut.  Luckily with time that hair will grow back and I will return to my beautiful self!<p/><p/>My personality color is GREEN. I am an adaptable cat who loves to go with the flow! I am outgoing and carefree, and I just can't wait to find my forever home!<p/><p/><p/>",
K19-116372,A582522,Regional Animal Services of King County,FOUND,https://petharbor.com/pet.asp?uaid=KING.A582522,"King County Pet Adoption Center 21615 64TH AVE S KENT, WA 98032",Big Bertha,Cat,3 YEARS,Spayed Female,Domestic Longhair,Black,04/08/2019 12:00:00 AM,Received on,24400 SE 470TH ST,ENUMCLAW,WA,98022,KING COUNTY,,,https://petharbor.com/get_image.asp?RES=Detail&LOCATION=KING&ID=A582522,Image Copyright HLP Inc. 2019,"Received on: 2019-04-08<p/> Found Near: 24400 SE 470TH ST, ENUMCLAW WA 98022<p/> Description: Black Spayed Female Domestic Longhair Cat<p/> Age: 3 YEARS<p/> Current Location: King County Pet Adoption Center 21615 64TH AVE S KENT, WA 98032<p/>",
K19-116396,A567385,Regional Animal Services of King County,ADOPTABLE,https://petharbor.com/pet.asp?uaid=KING.A567385,"King County Pet Adoption Center 21615 64TH AVE S KENT, WA 98032",Angel,Dog,3 YEARS 4 MONTHS,Spayed Female,Labrador Retriever / Pit Bull,Black / White,04/09/2019 12:00:00 AM,Received on,,,,,,,,https://petharbor.com/get_image.asp?RES=Detail&LOCATION=KING&ID=A567385,Image Copyright HLP Inc. 2019,"Received on: 2019-04-09<p/> Description: Black / White<p/>  Spayed Female Labrador Retriever / Pit Bull Dog<p/> Age: 3 YEARS 4 MONTHS<p/> Adoption Fee: $100.00<p/> Current Location: King County Pet Adoption Center 21615 64TH AVE S KENT, WA 98032<p/>Hi! My name is Angel and I am available for adoption.<p/><p/>I was brought in by my previous owner on April 9, 2019 because they had too many dogs. I lived in a home with other dogs, and older children. I'm very sweet but I am a bit of a scaredy cat!  I am looking for a home where I can live in a nice and calm environment. I love to snuggle and give face kisses but please respect my space until we've established a relationship!  <p/><p/>I do like other dogs, but I'd like to get to know them first. I can be very afraid of them, so I would like to meet them and make sure we're a good match. I will likely get along with a calm dog who gives me lots of space. <p/><p/>My personality color is BLUE. I am a gentle and loving dog who likes to take things slow. I may get nervous in new situations, so I am looking for a family who understands that I might take some time to warm up. Once I get to know you, I will be a very devoted friend!<p/><p/><p/>",BLUE
K19-116436,A582728,Regional Animal Services of King County,ADOPTABLE,https://petharbor.com/pet.asp?uaid=KING.A582728,"King County Pet Adoption Center 21615 64TH AVE S KENT, WA 98032",Shania,Dog,5 YEARS,Spayed Female,Pit Bull,Brown / White,04/11/2019 12:00:00 AM,Received on,,,,,,,,https://petharbor.com/get_image.asp?RES=Detail&LOCATION=KING&ID=A582728,Image Copyright HLP Inc. 2019,"Received on: 2019-04-11<p/> Description: Brown / White<p/>  Spayed Female Pit Bull Dog<p/> Age: 5 YEARS<p/> Adoption Fee: $100.00<p/> Current Location: King County Pet Adoption Center 21615 64TH AVE S KENT, WA 98032<p/>Hi! My name is Shania and I am available for adoption.<p/><p/>I was brought in by a good samaritan on April 15th, 2019.<p/><p/>I'm a very shy gal who needs some TLC and time to really gain my trust and confidence. I really do love people and all the love they have to offer me, I just take my time getting to know them. I love anything with a squeaker in it and carry my toys around with me. Fetch is also one of my favorite things to do outside. I love to get pets and snuggle with my person on the couch or in bed and would be a great couch potatoe. My caregivers have noticed that I seem to do well with other large dogs. When meeting dogs in a new home, I would do best with a slow introduction.<p/><p/>My personality color is BLUE. I am a gentle and loving dog who likes to take things slow. I may get nervous in new situations, so I am looking for a family who understands that I might take some time to warm up. Once I get to know you, I will be a very devoted friend!<p/><p/>",BLUE
K19-116436,A582728,Regional Animal Services of King County,FOUND,https://petharbor.com/pet.asp?uaid=KING.A582728,"King County Pet Adoption Center 21615 64TH AVE S KENT, WA 98032",Shania,Dog,5 YEARS,Spayed Female,Pit Bull,Brown / White,04/11/2019 12:00:00 AM,Received on,8300 S 212TH ST,KENT,WA,98032,KENT,,,https://petharbor.com/get_image.asp?RES=Detail&LOCATION=KING&ID=A582728,Image Copyright HLP Inc. 2019,"Received on: 2019-04-11<p/> Found Near: 8300 S 212TH ST, KENT WA 98032<p/> Description: Brown / White Spayed Female Pit Bull Dog<p/> Age: 5 YEARS<p/> Current Location: King County Pet Adoption Center 21615 64TH AVE S KENT, WA 98032<p/>",BLUE
K19-116471,A582858,Regional Animal Services of King County,FOUND,https://kingcounty.gov/depts/regional-animal-services/about-us/overview.aspx,,,Dead Dog,NO AGE,Female,German Shepherd,Black / Tan,04/13/2019 12:00:00 AM,Received on,4100 S 272ND ST,KENT,WA,98032,KING COUNTY,47.357875,-122.282904,,Image Copyright HLP Inc. 2019,"Received on: 2019-04-13<p/> Found Near: 4100 S 272ND ST, KENT WA 98032<p/> Description: Black / Tan Female German Shepherd Dog<p/> Age: NO AGE<p/>",
K19-116519,A583023,Regional Animal Services of King County,FOUND,https://petharbor.com/pet.asp?uaid=KING.A583023,"King County Pet Adoption Center 21615 64TH AVE S KENT, WA 98032",Cpt. Morgan,Cat,1 YEAR,Neutered Male,Domestic Shorthair,Black / White,04/16/2019 12:00:00 AM,Received on,17300 SE LAKE MONEYSMITH RD,AUBURN,WA,98092,KING COUNTY,,,https://petharbor.com/get_image.asp?RES=Detail&LOCATION=KING&ID=A583023,Image Copyright HLP Inc. 2019,"Received on: 2019-04-16<p/> Found Near: 17300 SE LAKE MONEYSMITH RD, AUBURN WA 98092<p/> Description: Black / White Neutered Male Domestic Shorthair Cat<p/> Age: 1 YEAR<p/> Current Location: King County Pet Adoption Center 21615 64TH AVE S KENT, WA 98032<p/>",RED
K19-116550,A583178,Regional Animal Services of King County,ADOPTABLE,https://petharbor.com/pet.asp?uaid=KING.A583178,"King County Pet Adoption Center 21615 64TH AVE S KENT, WA 98032",Popeye,Cat,11 YEARS,Neutered Male,Domestic Shorthair,Org Tabby / White,04/17/2019 12:00:00 AM,Received on,,,,,,,,https://petharbor.com/get_image.asp?RES=Detail&LOCATION=KING&ID=A583178,Image Copyright HLP Inc. 2019,"Received on: 2019-04-17<p/> Description: Org Tabby / White<p/>  Neutered Male Domestic Shorthair Cat<p/> Age: 11 YEARS<p/> Adoption Fee: $30.00<p/> Current Location: King County Pet Adoption Center 21615 64TH AVE S KENT, WA 98032<p/>Hi! My name is Popeye and I am available for adoption.<p/><p/>I was brought in by my previous owner on 4/17/19 because they were moving. I lived in a home with other cats and have been around men, women and children of all ages. My previous owner described me as shy, gentle, sweet and mellow. I love to be petted, held and sit in your lap.<p/><p/>My personality color is BLUE. I am a gentle and loving cat who likes to take things slow. I may get nervous in new situations, so I am looking for a family who understands that I might need some time to warm up. Once I get to know you, I will be a very devoted friend!<p/><p/>I am an affectionate lovebug who would be thrilled to cuddle up with you at home!<p/><p/>My caregivers have noticed that I seem to do well with other cats. When meeting cats in a new home, I would do best with a slow introduction.<p/><p/>Because of my shy nature, I would do best in a calm, quiet home.<p/>",
K19-116559,A583233,Regional Animal Services of King County,ADOPTABLE,https://petharbor.com/pet.asp?uaid=KING.A583233,"Kirkland Petco 12040 NE 85TH ST KIRKLAND, WA 98033",Tiger,Cat,2 YEARS,Neutered Male,Domestic Shorthair,Brn Tabby,04/18/2019 12:00:00 AM,Received on,12040 NE 85TH ST,KIRKLAND,WA,98033,KIRKLAND,47.680519,-122.179195,https://petharbor.com/get_image.asp?RES=Detail&LOCATION=KING&ID=A583233,Image Copyright HLP Inc. 2019,"Received on: 2019-04-18<p/> Description: Brn Tabby<p/>  Neutered Male Domestic Shorthair Cat<p/> Age: 2 YEARS<p/> Adoption Fee: $30.00<p/> Current Location: Kirkland Petco 12040 NE 85TH ST KIRKLAND, WA 98033<p/>Hi! My name is Tiger and I am available for adoption. I was brought in by an Animal Control Officer on April 18, 2019.<p/><p/>I'm super sweet but very nervous in this environment. If you go slow and give me head and neck pets I will start to warm up to you. I don't really enjoy being held, I'm a little bit independent and it makes me uncomfortable. I haven't ever lived with a cat, but I think I would probably like them and would give it a try. <p/><p/>My personality color is BLUE. I am a gentle and loving cat who likes to take things slow. I may get nervous in new situations, so I am looking for a family who understands that I might need some time to warm up. Once I get to know you, I will be a very devoted friend!<p/><p/>",BLUE
K19-116568,A583284,Regional Animal Services of King County,FOUND,https://kingcounty.gov/depts/regional-animal-services/about-us/overview.aspx,,,Dead Cat,NO AGE,Unaltered,Domestic Mediumhair,Calico,04/19/2019 12:00:00 AM,Received on,18600 SE 128TH ST,RENTON,WA,98059,KING COUNTY,,,,Image Copyright HLP Inc. 2019,"Received on: 2019-04-19<p/> Found Near: 18600 SE 128TH ST, RENTON WA 98059<p/> Description: Calico Unaltered Domestic Mediumhair Cat<p/> Age: NO AGE<p/>",
K19-116587,A583342,Regional Animal Services of King County,FOUND,https://petharbor.com/pet.asp?uaid=KING.A583342,"King County Pet Adoption Center 21615 64TH AVE S KENT, WA 98032",Mallory,Cat,10 YEARS,Spayed Female,Domestic Longhair,Tortie,04/20/2019 12:00:00 AM,Received on,23600 PACIFIC HWY S,KENT,WA,98032,KENT,,,https://petharbor.com/get_image.asp?RES=Detail&LOCATION=KING&ID=A583342,Image Copyright HLP Inc. 2019,"Received on: 2019-04-20<p/> Found Near: 23600 PACIFIC HWY S, KENT WA 98032<p/> Description: Tortie Spayed Female Domestic Longhair Cat<p/> Age: 10 YEARS<p/> Current Location: King County Pet Adoption Center 21615 64TH AVE S KENT, WA 98032<p/>",
K19-116654,A583525,Regional Animal Services of King County,FOUND,https://kingcounty.gov/depts/regional-animal-services/about-us/overview.aspx,,,Dead Cat,NO AGE,Unaltered,Domestic Mediumhair,Brn Tabby,04/23/2019 12:00:00 AM,Received on,11600 SE 258TH ST,KENT,WA,98030,KENT,,,,Image Copyright HLP Inc. 2019,"Received on: 2019-04-23<p/> Found Near: 11600 SE 258TH ST, KENT WA 98030<p/> Description: Brn Tabby Unaltered Domestic Mediumhair Cat<p/> Age: NO AGE<p/>",
K19-116648,A574834,Regional Animal Services of King County,FOUND,https://kingcounty.gov/depts/regional-animal-services/about-us/overview.aspx,,7,Dead Cat,1 YEAR 5 MONTHS,Neutered Male,Domestic Shorthair,Black,04/23/2019 12:00:00 AM,Received on,19800 140TH AVE SE,RENTON,WA,98058,KING COUNTY,,,,Image Copyright HLP Inc. 2019,"Received on: 2019-04-23<p/> Found Near: 19800 140TH AVE SE, RENTON WA 98058<p/> Description: Black Neutered Male Domestic Shorthair Cat<p/> Age: 1 YEAR 5 MONTHS<p/>",
K19-116651,A583521,Regional Animal Services of King County,FOUND,https://kingcounty.gov/depts/regional-animal-services/about-us/overview.aspx,,,Dead Cat,NO AGE,Unaltered,Domestic Shorthair,Gray,04/23/2019 12:00:00 AM,Received on,23700 100TH AVE SE,KENT,WA,98031,KENT,,,,Image Copyright HLP Inc. 2019,"Received on: 2019-04-23<p/> Found Near: 23700 100TH AVE SE, KENT WA 98031<p/> Description: Gray Unaltered Domestic Shorthair Cat<p/> Age: NO AGE<p/>",
K19-116656,A583527,Regional Animal Services of King County,FOUND,https://petharbor.com/pet.asp?uaid=KING.A583527,"King County Pet Adoption Center 21615 64TH AVE S KENT, WA 98032",Beverley,Cat,1 YEAR,Female,Domestic Shorthair,Black,04/23/2019 12:00:00 AM,Received on,3200 S 169TH ST,SEATAC,WA,98188,SEATAC,,,https://petharbor.com/get_image.asp?RES=Detail&LOCATION=KING&ID=A583527,Image Copyright HLP Inc. 2019,"Received on: 2019-04-23<p/> Found Near: 3200 S 169TH ST, SEATAC WA 98188<p/> Description: Black Female Domestic Shorthair Cat<p/> Age: 1 YEAR<p/> Current Location: King County Pet Adoption Center 21615 64TH AVE S KENT, WA 98032<p/>",
K19-116632,A583503,Regional Animal Services of King County,FOUND,https://kingcounty.gov/depts/regional-animal-services/about-us/overview.aspx,,,Dead Cat,2 YEARS,Male,Domestic Shorthair,Org Tabby,04/23/2019 12:00:00 AM,Received on,6800 148TH AVE NE,REDMOND,WA,98052,REDMOND,47.661856,-122.143092,,Image Copyright HLP Inc. 2019,"Received on: 2019-04-23<p/> Found Near: 6800 148TH AVE NE, REDMOND WA 98052<p/> Description: Org Tabby Male Domestic Shorthair Cat<p/> Age: 2 YEARS<p/>",
K19-116673,A583586,Regional Animal Services of King County,ADOPTABLE,https://petharbor.com/pet.asp?uaid=KING.A583586,"King County Pet Adoption Center 21615 64TH AVE S KENT, WA 98032",Sergio,Dog,3 YEARS,Neutered Male,Pit Bull / Siberian Husky,Tan / White,04/24/2019 12:00:00 AM,Received on,,,,,,,,https://petharbor.com/get_image.asp?RES=Detail&LOCATION=KING&ID=A583586,Image Copyright HLP Inc. 2019,"Received on: 2019-04-24<p/> Description: Tan / White<p/>  Neutered Male Pit Bull / Siberian Husky Dog<p/> Age: 3 YEARS<p/> Adoption Fee: $225.00<p/> Current Location: King County Pet Adoption Center 21615 64TH AVE S KENT, WA 98032<p/>Hi! My name is Sergio and I am available for adoption.<p/><p/>I was brought in by an Animal Control Officer on 4/24/19.<p/><p/>My personality color is GREEN. I am an adaptable dog who loves to go with the flow! I am outgoing and carefree, and I just can't wait to find my forever home!<p/><p/>I am an affectionate lovebug who would be thrilled to cuddle up with you at home!<p/><p/>I am full of energy and I love to play! I tend to calm down more when the people around me stay calm. I do best when I have lots of exercise and something to keep my mind busy.<p/><p/><p/>",GREEN
K19-116673,A583586,Regional Animal Services of King County,FOUND,https://petharbor.com/pet.asp?uaid=KING.A583586,"King County Pet Adoption Center 21615 64TH AVE S KENT, WA 98032",Sergio,Dog,3 YEARS,Neutered Male,Pit Bull / Siberian Husky,Tan / White,04/24/2019 12:00:00 AM,Received on,27000 174TH PL SE,COVINGTON,WA,98042,COVINGTON,,,https://petharbor.com/get_image.asp?RES=Detail&LOCATION=KING&ID=A583586,Image Copyright HLP Inc. 2019,"Received on: 2019-04-24<p/> Found Near: 27000 174TH PL SE, COVINGTON WA 98042<p/> Description: Tan / White Neutered Male Pit Bull / Siberian Husky Dog<p/> Age: 3 YEARS<p/> Current Location: King County Pet Adoption Center 21615 64TH AVE S KENT, WA 98032<p/>",GREEN
K19-116719,A583707,Regional Animal Services of King County,ADOPTABLE,https://petharbor.com/pet.asp?uaid=KING.A583707,"King County Pet Adoption Center 21615 64TH AVE S KENT, WA 98032",Walter,Rat,1 YEAR 6 MONTHS,Male,Rat,Gray / White,04/25/2019 12:00:00 AM,Received on,,,,,,,,https://petharbor.com/get_image.asp?RES=Detail&LOCATION=KING&ID=A583707,Image Copyright HLP Inc. 2019,"Received on: 2019-04-25<p/> Description: Gray / White<p/>  Male Rat Rat<p/> Age: 1 YEAR 6 MONTHS<p/> Adoption Fee: An Adoption Fee has not been set. Please inquire with the shelter.<p/> Current Location: King County Pet Adoption Center 21615 64TH AVE S KENT, WA 98032<p/><p/>",
K19-116720,A583708,Regional Animal Services of King County,ADOPTABLE,https://petharbor.com/pet.asp?uaid=KING.A583708,"King County Pet Adoption Center 21615 64TH AVE S KENT, WA 98032",Edgar,Rat,1 YEAR 6 MONTHS,Male,Rat,Gray / White,04/25/2019 12:00:00 AM,Received on,,,,,,,,https://petharbor.com/get_image.asp?RES=Detail&LOCATION=KING&ID=A583708,Image Copyright HLP Inc. 2019,"Received on: 2019-04-25<p/> Description: Gray / White<p/>  Male Rat Rat<p/> Age: 1 YEAR 6 MONTHS<p/> Adoption Fee: An Adoption Fee has not been set. Please inquire with the shelter.<p/> Current Location: King County Pet Adoption Center 21615 64TH AVE S KENT, WA 98032<p/><p/>",
K19-116711,A583690,Regional Animal Services of King County,ADOPTABLE,https://petharbor.com/pet.asp?uaid=KING.A583690,"Kirkland Petco 12040 NE 85TH ST KIRKLAND, WA 98033",Coco,Cat,2 YEARS,Spayed Female,Domestic Shorthair,Tortie,04/25/2019 12:00:00 AM,Received on,12040 NE 85TH ST,KIRKLAND,WA,98033,KIRKLAND,47.680519,-122.179195,https://petharbor.com/get_image.asp?RES=Detail&LOCATION=KING&ID=A583690,Image Copyright HLP Inc. 2019,"Received on: 2019-04-25<p/> Description: Tortie<p/>  Spayed Female Domestic Shorthair Cat<p/> Age: 2 YEARS<p/> Adoption Fee: $30.00<p/> Current Location: Kirkland Petco 12040 NE 85TH ST KIRKLAND, WA 98033<p/>Hi! My name is CoCo and I am available for adoption. I was brought in by my previous owner on April 25, 2019 because they had too many cats. My previous owner described me as shy.<p/><p/>I am an independent kitty who likes to do my own thing!<p/><p/>Because of my shy nature, I would do best in a calm, quiet home.<p/><p/>My personality color is BLUE. I am a gentle and loving cat who likes to take things slow. I may get nervous in new situations, so I am looking for a family who understands that I might need some time to warm up. Once I get to know you, I will be a very devoted friend!<p/><p/><p/>",
K19-116730,A583727,Regional Animal Services of King County,ADOPTABLE,https://kingcounty.gov/depts/regional-animal-services/about-us/overview.aspx,In RASKC Foster Home,Cheddar,Cat,2 YEARS,Neutered Male,Domestic Longhair,Org Tabby / White,04/26/2019 12:00:00 AM,Received on,21615 64TH AVE S,KENT,WA,98032,KING COUNTY,47.407788,-122.255197,https://petharbor.com/get_image.asp?RES=Detail&LOCATION=KING&ID=A583727,Image Copyright HLP Inc. 2019,"Received on: 2019-04-26<p/> Description: Org Tabby / White Neutered Male Domestic Longhair Cat<p/> Age: 2 YEARS<p/> Adoption Fee: $30.00<p/> Current Location: In RASKC Foster Home <p/>Hi! My name is Cheddar and I am available for adoption.<p/><p/>I was brought in by a good samaritan on April 25, 2019. <p/><p/>I'm a fun, loving guy with a delightful personality.  I'm super sweet and affectionate but I also like to run around and play! I'm looking for a loving family with lots of attention to give me!<p/><p/>My personality color is GREEN. I am an adaptable cat who loves to go with the flow! I am outgoing and carefree, and I just can't wait to find my forever home!<p/><p/><p/>",
K19-116736,A583747,Regional Animal Services of King County,ADOPTABLE,https://petharbor.com/pet.asp?uaid=KING.A583747,"King County Pet Adoption Center 21615 64TH AVE S KENT, WA 98032",Dude,Dog,7 YEARS,Neutered Male,Labrador Retriever / Pit Bull,Red,04/26/2019 12:00:00 AM,Received on,,,,,,,,https://petharbor.com/get_image.asp?RES=Detail&LOCATION=KING&ID=A583747,Image Copyright HLP Inc. 2019,"Received on: 2019-04-26<p/> Description: Red<p/>  Neutered Male Labrador Retriever / Pit Bull Dog<p/> Age: 7 YEARS<p/> Adoption Fee: $200.00<p/> Current Location: King County Pet Adoption Center 21615 64TH AVE S KENT, WA 98032<p/>Hi! My name is Dude and I am available for adoption.<p/><p/>I was brought in by my previous owner on 4/26/19 because they were unable to care for me. I lived in a home with dogs, young/older children]. <p/><p/>My personality color is GREEN. I am an adaptable dog who loves to go with the flow! I am outgoing and carefree, and I just can't wait to find my forever home!<p/><p/>I am a very smart dog! I have shown my caregivers that I already know how to ""sit"", ""stay"", ""come"", ""down"" and ""shake"".<p/><p/>I am an affectionate lovebug who would be thrilled to cuddle up with you at home!<p/><p/>I am full of energy and I love to play! I tend to calm down more when the people around me stay calm. I do best when I have lots of exercise and something to keep my mind busy.<p/><p/>My caregivers have noticed that I seem to do well with other large dogs. When meeting dogs in a new home, I would do best with a slow introduction.<p/><p/><p/>",GREEN
K19-116752,A583774,Regional Animal Services of King County,ADOPTABLE,https://kingcounty.gov/depts/regional-animal-services/about-us/overview.aspx,In RASKC Foster Home,Ax,Cat,2 YEARS,Neutered Male,Domestic Shorthair,Org Tabby,04/27/2019 12:00:00 AM,Received on,21615 64TH AVE S,KENT,WA,98032,ENUMCLAW,47.407788,-122.255197,https://petharbor.com/get_image.asp?RES=Detail&LOCATION=KING&ID=A583774,Image Copyright HLP Inc. 2019,"Received on: 2019-04-27<p/> Description: Org Tabby Neutered Male Domestic Shorthair Cat<p/> Age: 2 YEARS<p/> Adoption Fee: $30.00<p/> Current Location: In RASKC Foster Home <p/>Hi! My name is Ax and I am available for adoption.<p/><p/>I was brought in by my previous owner on April 27, 2019 because they were moving. I lived in a home with another cat named Dently, and we would love a home together. We are both very nervous in this environment, but at least we have each other!  We love to snuggle and sometimes we even lay on top of each other.  We are looking for the perfect home that wants two gorgeous, orange kitties! <p/><p/>My personality color is BLUE. I am a gentle and loving cat who likes to take things slow. I may get nervous in new situations, so I am looking for a family who understands that I might need some time to warm up. Once I get to know you, I will be a very devoted friend!<p/><p/><p/>",
K19-116753,A583775,Regional Animal Services of King County,ADOPTABLE,https://kingcounty.gov/depts/regional-animal-services/about-us/overview.aspx,In RASKC Foster Home,Dently,Cat,2 YEARS,Neutered Male,Domestic Shorthair,Org Tabby,04/27/2019 12:00:00 AM,Received on,21615 64TH AVE S,KENT,WA,98032,ENUMCLAW,47.407788,-122.255197,https://petharbor.com/get_image.asp?RES=Detail&LOCATION=KING&ID=A583775,Image Copyright HLP Inc. 2019,"Received on: 2019-04-27<p/> Description: Org Tabby Neutered Male Domestic Shorthair Cat<p/> Age: 2 YEARS<p/> Adoption Fee: $30.00<p/> Current Location: In RASKC Foster Home <p/>Hi! My name is Dently and I am available for adoption.<p/><p/>I was brought in by my previous owner on April 27, 2019 because they were moving. I lived in a home with another cat named Ax, and we would love a home together. We are both very nervous in this environment, but at least we have each other!  We love to snuggle and sometimes we even lay on top of each other.  We are looking for the perfect home that wants two gorgeous, orange kitties! <p/><p/>My personality color is BLUE. I am a gentle and loving cat who likes to take things slow. I may get nervous in new situations, so I am looking for a family who understands that I might need some time to warm up. Once I get to know you, I will be a very devoted friend!<p/><p/>",
K19-116765,A583783,Regional Animal Services of King County,FOUND,https://kingcounty.gov/depts/regional-animal-services/about-us/overview.aspx,In RASKC Foster Home,Katrina,Cat,1 YEAR,Female,Domestic Longhair,Black / White,04/27/2019 12:00:00 AM,Received on,10300 SE 225TH PL,KENT,WA,98031,KENT,,,https://petharbor.com/get_image.asp?RES=Detail&LOCATION=KING&ID=A583783,Image Copyright HLP Inc. 2019,"Received on: 2019-04-27<p/> Found Near: 10300 SE 225TH PL, KENT WA 98031<p/> Description: Black / White Female Domestic Longhair Cat<p/> Age: 1 YEAR<p/> Current Location: In RASKC Foster Home <p/>",
K19-116763,A583781,Regional Animal Services of King County,FOUND,https://kingcounty.gov/depts/regional-animal-services/about-us/overview.aspx,In RASKC Foster Home,,Cat,6 WEEKS,Female,Domestic Longhair,Black / White,04/27/2019 12:00:00 AM,Received on,10300 SE 225TH PL,KENT,WA,98031,KENT,,,https://petharbor.com/get_image.asp?RES=Detail&LOCATION=KING&ID=A583781,Image Copyright HLP Inc. 2019,"Received on: 2019-04-27<p/> Found Near: 10300 SE 225TH PL, KENT WA 98031<p/> Description: Black / White Female Domestic Longhair Cat<p/> Age: 6 WEEKS<p/> Current Location: In RASKC Foster Home <p/>",
K19-116762,A583780,Regional Animal Services of King County,FOUND,https://kingcounty.gov/depts/regional-animal-services/about-us/overview.aspx,In RASKC Foster Home,,Cat,6 WEEKS,Male,Domestic Longhair,Brn Tabby / White,04/27/2019 12:00:00 AM,Received on,10300 SE 225TH PL,KENT,WA,98031,KENT,,,https://petharbor.com/get_image.asp?RES=Detail&LOCATION=KING&ID=A583780,Image Copyright HLP Inc. 2019,"Received on: 2019-04-27<p/> Found Near: 10300 SE 225TH PL, KENT WA 98031<p/> Description: Brn Tabby / White Male Domestic Longhair Cat<p/> Age: 6 WEEKS<p/> Current Location: In RASKC Foster Home <p/>",
K19-116764,A583782,Regional Animal Services of King County,FOUND,https://kingcounty.gov/depts/regional-animal-services/about-us/overview.aspx,In RASKC Foster Home,,Cat,6 WEEKS,Female,Domestic Shorthair,Gray / White,04/27/2019 12:00:00 AM,Received on,10300 SE 225TH PL,KENT,WA,98031,KENT,,,https://petharbor.com/get_image.asp?RES=Detail&LOCATION=KING&ID=A583782,Image Copyright HLP Inc. 2019,"Received on: 2019-04-27<p/> Found Near: 10300 SE 225TH PL, KENT WA 98031<p/> Description: Gray / White Female Domestic Shorthair Cat<p/> Age: 6 WEEKS<p/> Current Location: In RASKC Foster Home <p/>",
K19-116768,A583784,Regional Animal Services of King County,FOUND,https://kingcounty.gov/depts/regional-animal-services/about-us/overview.aspx,In RASKC Foster Home,,Cat,10 WEEKS,Male,Domestic Shorthair,Gray,04/27/2019 12:00:00 AM,Received on,25600 29TH AVE S,KENT,WA,98032,KENT,,,https://petharbor.com/get_image.asp?RES=Detail&LOCATION=KING&ID=A583784,Image Copyright HLP Inc. 2019,"Received on: 2019-04-27<p/> Found Near: 25600 29TH AVE S, KENT WA 98032<p/> Description: Gray Male Domestic Shorthair Cat<p/> Age: 10 WEEKS<p/> Current Location: In RASKC Foster Home <p/>",
K19-116789,A583813,Regional Animal Services of King County,ADOPTABLE,https://petharbor.com/pet.asp?uaid=KING.A583813,"King County Pet Adoption Center 21615 64TH AVE S KENT, WA 98032",Mimas,Cat,1 YEAR,Spayed Female,Domestic Shorthair,Black,04/28/2019 12:00:00 AM,Received on,,,,,,,,https://petharbor.com/get_image.asp?RES=Detail&LOCATION=KING&ID=A583813,Image Copyright HLP Inc. 2019,"Received on: 2019-04-28<p/> Description: Black<p/>  Spayed Female Domestic Shorthair Cat<p/> Age: 1 YEAR<p/> Adoption Fee: $30.00<p/> Current Location: King County Pet Adoption Center 21615 64TH AVE S KENT, WA 98032<p/>Hi! My name is Mima and I am available for adoption.<p/><p/><p/>I was brought in by a good samaritan on 4/28/19.<p/><p/><p/>My personality color is BLUE. I am a gentle and loving cat who likes to take things slow. I may get nervous in new situations, so I am looking for a family who understands that I might need some time to warm up. Once I get to know you, I will be a very devoted friend!<p/><p/><p/>I am an affectionate lovebug who would be thrilled to cuddle up with you at home!<p/><p/><p/><p/>I may do well with other cats. When meeting cats in a new home, I would do best with a slow introduction.<p/><p/><p/>Because of my shy nature, I would do best in a calm, quiet home.<p/>",
K19-116791,A583814,Regional Animal Services of King County,FOUND,https://kingcounty.gov/depts/regional-animal-services/about-us/overview.aspx,,,Dead Bird,NO AGE,Unaltered,Duck,Yellow / Brown,04/28/2019 12:00:00 AM,Received on,16300 ASH WAY,LYNNWOOD,WA,98087,SNOHOMISH COUNT,,,,Image Copyright HLP Inc. 2019,"Received on: 2019-04-28<p/> Found Near: 16300 ASH WAY, LYNNWOOD WA 98087<p/> Description: Yellow / Brown Unaltered Duck Bird<p/> Age: NO AGE<p/>",
K19-116788,A583812,Regional Animal Services of King County,FOUND,https://kingcounty.gov/depts/regional-animal-services/about-us/overview.aspx,,,Dead Dog,NO AGE,Male,Pit Bull,Tan / White,04/28/2019 12:00:00 AM,Received on,21000 FRAGER RD S,KENT,WA,98032,KENT,47.41338,-122.265179,,Image Copyright HLP Inc. 2019,"Received on: 2019-04-28<p/> Found Near: 21000 FRAGER RD S, KENT WA 98032<p/> Description: Tan / White Male Pit Bull Dog<p/> Age: NO AGE<p/>",
K19-116789,A583813,Regional Animal Services of King County,FOUND,https://petharbor.com/pet.asp?uaid=KING.A583813,"King County Pet Adoption Center 21615 64TH AVE S KENT, WA 98032",Mimas,Cat,1 YEAR,Spayed Female,Domestic Shorthair,Black,04/28/2019 12:00:00 AM,Received on,24200 101ST PL SE,KENT,WA,98030,KENT,,,https://petharbor.com/get_image.asp?RES=Detail&LOCATION=KING&ID=A583813,Image Copyright HLP Inc. 2019,"Received on: 2019-04-28<p/> Found Near: 24200 101ST PL SE, KENT WA 98030<p/> Description: Black Spayed Female Domestic Shorthair Cat<p/> Age: 1 YEAR<p/> Current Location: King County Pet Adoption Center 21615 64TH AVE S KENT, WA 98032<p/>",
K19-116810,A583881,Regional Animal Services of King County,ADOPTABLE,https://petharbor.com/pet.asp?uaid=KING.A583881,"King County Pet Adoption Center 21615 64TH AVE S KENT, WA 98032",Edgar,Cat,2 YEARS,Neutered Male,Domestic Shorthair,Brn Tabby,04/29/2019 12:00:00 AM,Received on,,,,,,,,https://petharbor.com/get_image.asp?RES=Detail&LOCATION=KING&ID=A583881,Image Copyright HLP Inc. 2019,"Received on: 2019-04-29<p/> Description: Brn Tabby<p/>  Neutered Male Domestic Shorthair Cat<p/> Age: 2 YEARS<p/> Adoption Fee: $30.00<p/> Current Location: King County Pet Adoption Center 21615 64TH AVE S KENT, WA 98032<p/>Hi! My name is Edgar and I am available for adoption.<p/><p/>I was brought in by a good samaritan on April 29th, 2019.<p/><p/>I am a shy guy who tries really hard to be social but my nerves get the best of me sometimes and I hide. I really do love pets but because I am such a nervous nelly, I can get overstimulated with petting, so please move carefully with me and keep an eye out for signs that I might need a break .My caregivers have noticed that I seem to do well with other cats. When meeting cats in a new home, I would do best with a slow introduction.<p/><p/>My personality color is BLUE. I am a gentle and loving cat who likes to take things slow. I may get nervous in new situations, so I am looking for a family who understands that I might need some time to warm up. Once I get to know you, I will be a very devoted friend!<p/><p/>",BLUE
K19-116804,A583858,Regional Animal Services of King County,ADOPTABLE,https://petharbor.com/pet.asp?uaid=KING.A583858,"King County Pet Adoption Center 21615 64TH AVE S KENT, WA 98032",Garfield,Cat,1 YEAR 6 MONTHS,Neutered Male,Domestic Shorthair,Org Tabby / White,04/29/2019 12:00:00 AM,Received on,,,,,,,,https://petharbor.com/get_image.asp?RES=Detail&LOCATION=KING&ID=A583858,Image Copyright HLP Inc. 2019,"Received on: 2019-04-29<p/> Description: Org Tabby / White<p/>  Neutered Male Domestic Shorthair Cat<p/> Age: 1 YEAR 6 MONTHS<p/> Adoption Fee: $30.00<p/> Current Location: King County Pet Adoption Center 21615 64TH AVE S KENT, WA 98032<p/>Hi! My name is Garfield and I am available for adoption.<p/><p/>I was brought in by my previous owner on 4/29/19. I've lived mainly outdoors with my brothers and sisters. My previous owner described me as shy and loving.<p/><p/>Hi there, I'm what you would call an undersocialized kitten. It doesn't mean anything bad it just means when I was wee little one, I was not taught about how nice and awesome people can be to me. I'm very scared at first but once you take the time to show me I can trust you, I will melt in your arms. Although, I'm a fearful kitty, I actually really love to snuggle and purr! I would love to go to a home with one of my siblings or with a younger, confident kitty friend! <p/><p/>My personality color is BLUE. I am a gentle and loving cat who likes to take things slow. I may get nervous in new situations, so I am looking for a family who understands that I might need some time to warm up. Once I get to know you, I will be a very devoted friend!<p/><p/>",
K19-116800,A583853,Regional Animal Services of King County,ADOPTABLE,https://petharbor.com/pet.asp?uaid=KING.A583853,"King County Pet Adoption Center 21615 64TH AVE S KENT, WA 98032",Maggie,Cat,1 YEAR,Spayed Female,Siamese,Seal Pt,04/29/2019 12:00:00 AM,Received on,,,,,,,,https://petharbor.com/get_image.asp?RES=Detail&LOCATION=KING&ID=A583853,Image Copyright HLP Inc. 2019,"Received on: 2019-04-29<p/> Description: Seal Pt<p/>  Spayed Female Siamese Cat<p/> Age: 1 YEAR<p/> Adoption Fee: $30.00<p/> Current Location: King County Pet Adoption Center 21615 64TH AVE S KENT, WA 98032<p/>Hi! My name is Maggie and I am available for adoption.<p/><p/>I was brought in with my brothers and sisters by my previous owner on 4/29/19. I've lived mainly outdoors  with other cats. My previous owner described me as shy.<p/><p/>Hi there, I'm what you would call an undersocialized kitten. It doesn't mean anything bad it just means when I was wee little one, I was not taught about how nice and awesome people can be to me. I'm very scared at first but once you take the time to show me I can trust you, I will melt in your arms. Although, I'm a fearful kitty, I actually really love to snuggle and purr! I would love to go to a home with one of my siblings or with a younger, confident kitty friend! <p/><p/>My personality color is BLUE/GREEN. I am a gentle and loving cat who likes to take things slow. I may get nervous in new situations but I quikly warm up. Once I get to know you, I will be a very devoted friend!<p/><p/>",BLUE
K19-116813,A583884,Regional Animal Services of King County,FOUND,https://petharbor.com/pet.asp?uaid=KING.A583884,"King County Pet Adoption Center 21615 64TH AVE S KENT, WA 98032",Storm,Cat,3 YEARS,Spayed Female,Domestic Shorthair,Gray,04/29/2019 12:00:00 AM,Received on,13900 SE 275TH ST,KENT,WA,98042,KENT,,,https://petharbor.com/get_image.asp?RES=Detail&LOCATION=KING&ID=A583884,Image Copyright HLP Inc. 2019,"Received on: 2019-04-29<p/> Found Near: 13900 SE 275TH ST, KENT WA 98042<p/> Description: Gray Spayed Female Domestic Shorthair Cat<p/> Age: 3 YEARS<p/> Current Location: King County Pet Adoption Center 21615 64TH AVE S KENT, WA 98032<p/>",RED
K19-116810,A583881,Regional Animal Services of King County,FOUND,https://petharbor.com/pet.asp?uaid=KING.A583881,"King County Pet Adoption Center 21615 64TH AVE S KENT, WA 98032",Edgar,Cat,2 YEARS,Neutered Male,Domestic Shorthair,Brn Tabby,04/29/2019 12:00:00 AM,Received on,19900 SE 283RD ST,AUBURN,WA,98092,AUBURN,,,https://petharbor.com/get_image.asp?RES=Detail&LOCATION=KING&ID=A583881,Image Copyright HLP Inc. 2019,"Received on: 2019-04-29<p/> Found Near: 19900 SE 283RD ST, AUBURN WA 98092<p/> Description: Brn Tabby Neutered Male Domestic Shorthair Cat<p/> Age: 2 YEARS<p/> Current Location: King County Pet Adoption Center 21615 64TH AVE S KENT, WA 98032<p/>",BLUE
K19-116798,A583834,Regional Animal Services of King County,FOUND,https://petharbor.com/pet.asp?uaid=KING.A583834,"King County Pet Adoption Center 21615 64TH AVE S KENT, WA 98032",Nimbus,Dog,4 YEARS,Neutered Male,Pit Bull,Tricolor,04/29/2019 12:00:00 AM,Received on,22500 SE 444TH ST,ENUMCLAW,WA,98022,KING COUNTY,,,https://petharbor.com/get_image.asp?RES=Detail&LOCATION=KING&ID=A583834,Image Copyright HLP Inc. 2019,"Received on: 2019-04-29<p/> Found Near: 22500 SE 444TH ST, ENUMCLAW WA 98022<p/> Description: Tricolor Neutered Male Pit Bull Dog<p/> Age: 4 YEARS<p/> Current Location: King County Pet Adoption Center 21615 64TH AVE S KENT, WA 98032<p/>",RED
K19-116828,A393631,Regional Animal Services of King County,ADOPTABLE,https://petharbor.com/pet.asp?uaid=KING.A393631,"Reber Ranch 28606 132ND AVE SE KENT, WA 98042",Shilo,Cat,11 YEARS 8 MONTHS,Neutered Male,Domestic Shorthair,Black / White,04/30/2019 12:00:00 AM,Received on,28606 132ND AVE SE,KENT,WA,98042,KENT,47.344857,-122.164359,https://petharbor.com/get_image.asp?RES=Detail&LOCATION=KING&ID=A393631,Image Copyright HLP Inc. 2019,"Received on: 2019-04-30<p/> Description: Black / White<p/>  Neutered Male Domestic Shorthair Cat<p/> Age: 11 YEARS 8 MONTHS<p/> Adoption Fee: $30.00<p/> Current Location: Reber Ranch 28606 132ND AVE SE KENT, WA 98042<p/>Hi! My name is Shilo and I am available for adoption.<p/><p/><p/><p/>I was brought in by my previous owner on 4/30/19 because of housing issues. I lived in a home with other cats and children of all ages. My previous owner described me as outgoing, loving and devoted.<p/><p/><p/>My personality color is GREEN. I am an adaptable cat who loves to go with the flow! I am outgoing and carefree, and I just can't wait to find my forever home!<p/><p/><p/>I am an affectionate lovebug who would be thrilled to cuddle up with you at home!<p/><p/><p/>My caregivers have noticed that I do not seem to get along with other cats, so I may do best as the only cat in my new home.<p/><p/><p/>",GREEN
K19-116823,A583940,Regional Animal Services of King County,FOUND,https://petharbor.com/pet.asp?uaid=KING.A583940,"King County Pet Adoption Center 21615 64TH AVE S KENT, WA 98032",Messier,Cat,2 YEARS,Spayed Female,Domestic Shorthair,Gray,04/30/2019 12:00:00 AM,Received on,3400 S 262ND ST,KENT,WA,98032,KENT,,,https://petharbor.com/get_image.asp?RES=Detail&LOCATION=KING&ID=A583940,Image Copyright HLP Inc. 2019,"Received on: 2019-04-30<p/> Found Near: 3400 S 262ND ST, KENT WA 98032<p/> Description: Gray Spayed Female Domestic Shorthair Cat<p/> Age: 2 YEARS<p/> Current Location: King County Pet Adoption Center 21615 64TH AVE S KENT, WA 98032<p/>",
K19-116846,A584038,Regional Animal Services of King County,ADOPTABLE,https://petharbor.com/pet.asp?uaid=KING.A584038,"King County Pet Adoption Center 21615 64TH AVE S KENT, WA 98032",Missy,Dog,7 YEARS,Spayed Female,Chihuahua - Smooth Coated,Black / Brown,05/01/2019 12:00:00 AM,Received on,,,,,,,,https://petharbor.com/get_image.asp?RES=Detail&LOCATION=KING&ID=A584038,Image Copyright HLP Inc. 2019,"Received on: 2019-05-01<p/> Description: Black / Brown<p/>  Spayed Female Chihuahua - Smooth Coated Dog<p/> Age: 7 YEARS<p/> Adoption Fee: $200.00<p/> Current Location: King County Pet Adoption Center 21615 64TH AVE S KENT, WA 98032<p/>Hi! My name is Missy and I am available for adoption.<p/><p/>I was brought in by my previous owner on 5/1/19 because they are unable to care for me.<p/><p/>My personality color is BLUE. I am a gentle and loving dog who likes to take things slow. I may get nervous in new situations, so I am looking for a family who understands that I might take some time to warm up. Once I get to know you, I will be a very devoted friend!<p/><p/><p/>I am an affectionate lovebug who would be thrilled to cuddle up with you at home!<p/><p/>My caregivers have noticed that I seem to do well with other small dogs. When meeting dogs in a new home, I would do best with a slow introduction.<p/><p/>Because of my shy nature, I would do best in a calm, quiet home.<p/><p/><p/>",BLUE
K19-116854,A584050,Regional Animal Services of King County,ADOPTABLE,https://petharbor.com/pet.asp?uaid=KING.A584050,"King County Pet Adoption Center 21615 64TH AVE S KENT, WA 98032",Celeste,Cat,2 YEARS,Spayed Female,Domestic Longhair,Black,05/01/2019 12:00:00 AM,Received on,,,,,,,,https://petharbor.com/get_image.asp?RES=Detail&LOCATION=KING&ID=A584050,Image Copyright HLP Inc. 2019,"Received on: 2019-05-01<p/> Description: Black<p/>  Spayed Female Domestic Longhair Cat<p/> Age: 2 YEARS<p/> Adoption Fee: $30.00<p/> Current Location: King County Pet Adoption Center 21615 64TH AVE S KENT, WA 98032<p/>Hi! My name is Celeste and I am available for adoption.<p/><p/>I was brought in by a good samaritan on May 1, 2019.<p/><p/>I am a sweet but shy gal who just wants to relax and find a home to call my own. I really like quiet, serene and peaceful humans who love to give really nice chin scratches. Take me home and have a bestie for life! <p/><p/>My personality color is BLUE. I am a gentle and loving cat who likes to take things slow. I may get nervous in new situations, so I am looking for a family who understands that I might need some time to warm up. Once I get to know you, I will be a very devoted friend!<p/><p/><p/>",BLUE
K19-116853,A226824,Regional Animal Services of King County,ADOPTABLE,https://petharbor.com/pet.asp?uaid=KING.A226824,"King County Pet Adoption Center 21615 64TH AVE S KENT, WA 98032",Cookie,Dog,13 YEARS,Spayed Female,Shih Tzu / Mix,Gray / White,05/01/2019 12:00:00 AM,Received on,,,,,,,,https://petharbor.com/get_image.asp?RES=Detail&LOCATION=KING&ID=A226824,Image Copyright HLP Inc. 2019,"Received on: 2019-05-01<p/> Description: Gray / White<p/>  Spayed Female Shih Tzu / Mix Dog<p/> Age: 13 YEARS<p/> Adoption Fee: $150.00<p/> Current Location: King County Pet Adoption Center 21615 64TH AVE S KENT, WA 98032<p/>Hi! My name is Cookie and I am available for adoption.<p/><p/>I was brought in by my previous owner on 5/1/19 because unable to care for me.<p/><p/>My personality color is GREEN. I am an adaptable dog who loves to go with the flow! I am outgoing and carefree, and I just can't wait to find my forever home!<p/><p/>I am an affectionate lovebug who would be thrilled to cuddle up with you at home!<p/><p/>My caregivers have noticed that I seem to do well with other small dogs. When meeting dogs in a new home, I would do best with a slow introduction.<p/><p/><p/>",GREEN
K19-116854,A584050,Regional Animal Services of King County,FOUND,https://petharbor.com/pet.asp?uaid=KING.A584050,"King County Pet Adoption Center 21615 64TH AVE S KENT, WA 98032",Celeste,Cat,2 YEARS,Spayed Female,Domestic Longhair,Black,05/01/2019 12:00:00 AM,Received on,23800 110TH AVE SE,KENT,WA,98031,KENT,,,https://petharbor.com/get_image.asp?RES=Detail&LOCATION=KING&ID=A584050,Image Copyright HLP Inc. 2019,"Received on: 2019-05-01<p/> Found Near: 23800 110TH AVE SE, KENT WA 98031<p/> Description: Black Spayed Female Domestic Longhair Cat<p/> Age: 2 YEARS<p/> Current Location: King County Pet Adoption Center 21615 64TH AVE S KENT, WA 98032<p/>",BLUE
K19-116858,A584054,Regional Animal Services of King County,FOUND,https://kingcounty.gov/depts/regional-animal-services/about-us/overview.aspx,In RASKC Foster Home,,Cat,6 WEEKS,Male,Domestic Shorthair,Black / White,05/01/2019 12:00:00 AM,Received on,23800 110TH AVE SE,KENT,WA,98031,KENT,,,https://petharbor.com/get_image.asp?RES=Detail&LOCATION=KING&ID=A584054,Image Copyright HLP Inc. 2019,"Received on: 2019-05-01<p/> Found Near: 23800 110TH AVE SE, KENT WA 98031<p/> Description: Black / White Male Domestic Shorthair Cat<p/> Age: 6 WEEKS<p/> Current Location: In RASKC Foster Home <p/>",
K19-116857,A584053,Regional Animal Services of King County,FOUND,https://kingcounty.gov/depts/regional-animal-services/about-us/overview.aspx,In RASKC Foster Home,,Cat,6 WEEKS,Male,Domestic Shorthair,Brn Tabby,05/01/2019 12:00:00 AM,Received on,23800 110TH AVE SE,KENT,WA,98031,KENT,,,https://petharbor.com/get_image.asp?RES=Detail&LOCATION=KING&ID=A584053,Image Copyright HLP Inc. 2019,"Received on: 2019-05-01<p/> Found Near: 23800 110TH AVE SE, KENT WA 98031<p/> Description: Brn Tabby Male Domestic Shorthair Cat<p/> Age: 6 WEEKS<p/> Current Location: In RASKC Foster Home <p/>",
K19-116855,A584051,Regional Animal Services of King County,FOUND,https://kingcounty.gov/depts/regional-animal-services/about-us/overview.aspx,In RASKC Foster Home,,Cat,6 WEEKS,Male,Domestic Shorthair,Brn Tabby,05/01/2019 12:00:00 AM,Received on,23800 110TH AVE SE,KENT,WA,98031,KENT,,,https://petharbor.com/get_image.asp?RES=Detail&LOCATION=KING&ID=A584051,Image Copyright HLP Inc. 2019,"Received on: 2019-05-01<p/> Found Near: 23800 110TH AVE SE, KENT WA 98031<p/> Description: Brn Tabby Male Domestic Shorthair Cat<p/> Age: 6 WEEKS<p/> Current Location: In RASKC Foster Home <p/>",
K19-116856,A584052,Regional Animal Services of King County,FOUND,https://kingcounty.gov/depts/regional-animal-services/about-us/overview.aspx,In RASKC Foster Home,,Cat,6 WEEKS,Male,Domestic Shorthair,Brn Tabby,05/01/2019 12:00:00 AM,Received on,23800 110TH AVE SE,KENT,WA,98031,KENT,,,https://petharbor.com/get_image.asp?RES=Detail&LOCATION=KING&ID=A584052,Image Copyright HLP Inc. 2019,"Received on: 2019-05-01<p/> Found Near: 23800 110TH AVE SE, KENT WA 98031<p/> Description: Brn Tabby Male Domestic Shorthair Cat<p/> Age: 6 WEEKS<p/> Current Location: In RASKC Foster Home <p/>",
K19-116859,A584055,Regional Animal Services of King County,FOUND,https://kingcounty.gov/depts/regional-animal-services/about-us/overview.aspx,,,Dead Cat,4 YEARS,Unaltered,Domestic Shorthair,Black,05/01/2019 12:00:00 AM,Received on,24000 36TH AVE S,KENT,WA,98032,KENT,,,,Image Copyright HLP Inc. 2019,"Received on: 2019-05-01<p/> Found Near: 24000 36TH AVE S, KENT WA 98032<p/> Description: Black Unaltered Domestic Shorthair Cat<p/> Age: 4 YEARS<p/>",
K19-116874,A584097,Regional Animal Services of King County,ADOPTABLE,https://petharbor.com/pet.asp?uaid=KING.A584097,"Tukwila Petco 17200 SOUTHCENTER PKWY 100 TUKWILA, WA 98188",Orion,Cat,2 YEARS,Neutered Male,Domestic Shorthair,Brn Tabby,05/02/2019 12:00:00 AM,Received on,17200 SOUTHCENTER PKWY 100,TUKWILA,WA,98188,TUKWILA,47.449119,-122.25821,https://petharbor.com/get_image.asp?RES=Detail&LOCATION=KING&ID=A584097,Image Copyright HLP Inc. 2019,"Received on: 2019-05-02<p/> Description: Brn Tabby<p/>  Neutered Male Domestic Shorthair Cat<p/> Age: 2 YEARS<p/> Adoption Fee: $30.00<p/> Current Location: Tukwila Petco 17200 SOUTHCENTER PKWY 100 TUKWILA, WA 98188<p/>Hi! My name is Oion and I am available for adoption.<p/><p/>I was brought in by an Animal Control Officer on May 2, 2019.<p/><p/>I am an affectionate lovebug who would be thrilled to cuddle up with you at home!<p/><p/>My personality color is GREEN. I am an adaptable cat who loves to go with the flow! I am outgoing and carefree, and I just can't wait to find my forever home!<p/>",GREEN
K19-116887,A584139,Regional Animal Services of King County,ADOPTABLE,https://petharbor.com/pet.asp?uaid=KING.A584139,"King County Pet Adoption Center 21615 64TH AVE S KENT, WA 98032",Sydney,Dog,2 YEARS,Spayed Female,American Staffordshire / Mix,Brown / White,05/02/2019 12:00:00 AM,Received on,,,,,,,,https://petharbor.com/get_image.asp?RES=Detail&LOCATION=KING&ID=A584139,Image Copyright HLP Inc. 2019,"Received on: 2019-05-02<p/> Description: Brown / White<p/>  Spayed Female American Staffordshire / Mix Dog<p/> Age: 2 YEARS<p/> Adoption Fee: $100.00<p/> Current Location: King County Pet Adoption Center 21615 64TH AVE S KENT, WA 98032<p/>Hi, my name is Sydney!<p/><p/>I came to the shelter on 5/2/19.<p/><p/>My personality color is BLUE. I am a gentle and loving dog who likes to take things slow. I may get nervous in new situations, so I am looking for a family who understands that I might take some time to warm up. Once I get to know you, I will be a very devoted friend!<p/><p/>I am an affectionate lovebug who would be thrilled to cuddle up with you at home!<p/><p/>I am full of energy and I love to play! I tend to calm down more when the people around me stay calm. I do best when I have lots of exercise and something to keep my mind busy.<p/><p/>My caregivers have noticed that I seem to do well with other dogs. When meeting dogs in a new home, I would do best with a slow introduction.<p/><p/>I would do best in a home with older children.<p/><p/>Come meet me today!<p/>",BLUE
K19-116882,A584110,Regional Animal Services of King County,ADOPTABLE,https://petharbor.com/pet.asp?uaid=KING.A584110,"King County Pet Adoption Center 21615 64TH AVE S KENT, WA 98032",Daisy May,Cat,13 YEARS,Spayed Female,Domestic Longhair,Dilute Tor / White,05/02/2019 12:00:00 AM,Received on,,,,,,,,https://petharbor.com/get_image.asp?RES=Detail&LOCATION=KING&ID=A584110,Image Copyright HLP Inc. 2019,"Received on: 2019-05-02<p/> Description: Dilute Tor / White<p/>  Spayed Female Domestic Longhair Cat<p/> Age: 13 YEARS<p/> Adoption Fee: $30.00<p/> Current Location: King County Pet Adoption Center 21615 64TH AVE S KENT, WA 98032<p/>Hi! My name is Daisy May and I am available for adoption.<p/><p/>I was brought in by my previous owner on 5/2/19 because they were moving. I lived in a home with other cats and dogs. My previous owner described me as loving and playful.<p/><p/>I'm a good lap cat that just wants to hang out and relax with you. Although I am super sweet and snuggly, I do have an independent side and like to do my own thing. A few of my favorite things are bird watching in the window, snacks and a nice cozy lap. My caregivers have noticed that I seem to do well with other cats. When meeting cats in a new home, I would do best with a slow introduction.<p/><p/>My personality color is GREEN. I am an adaptable cat who loves to go with the flow! I am outgoing and carefree, and I just can't wait to find my forever home!<p/>",GREEN
K19-116886,A480900,Regional Animal Services of King County,ADOPTABLE,https://petharbor.com/pet.asp?uaid=KING.A480900,"King County Pet Adoption Center 21615 64TH AVE S KENT, WA 98032",Chester,Cat,13 YEARS 6 MONTHS,Neutered Male,Domestic Shorthair,Org Tabby / White,05/02/2019 12:00:00 AM,Received on,,,,,,,,https://petharbor.com/get_image.asp?RES=Detail&LOCATION=KING&ID=A480900,Image Copyright HLP Inc. 2019,"Received on: 2019-05-02<p/> Description: Org Tabby / White<p/>  Neutered Male Domestic Shorthair Cat<p/> Age: 13 YEARS 6 MONTHS<p/> Adoption Fee: $30.00<p/> Current Location: King County Pet Adoption Center 21615 64TH AVE S KENT, WA 98032<p/>Hi! My name is Chester and I am available for adoption.<p/><p/>I was brought in by my previous owner on 5/2/19 because I did not get along with baby in the house. I lived in a home with cats and young children but I did not get along with them. My previous owner described me as "" every stranger is a friend he just hasn't met yet"". And "" he is like a dog and licks and nibbles on everything""<p/><p/>My personality color is RED. I am a spirited cat with a fun-loving personality! I may be sensitive to handling, so I would do best in a home with a cat savvy family who knows when to give me some space.<p/><p/>I am an affectionate lovebug but I can also be an independent kitty who likes to do my own thing! If we can find the right balance between the two we will get along just fine.<p/><p/>I like getting attention on my own terms. I can get overstimulated with petting, so please move carefully with me and keep an eye out for signs that I might need a break.<p/><p/>My caregivers have noticed that I do not seem to get along with other cats, so I may do best as the only cat in my new home.<p/><p/>Because of my nature, I would do best in an adult.<p/>",
K19-116874,A584097,Regional Animal Services of King County,FOUND,https://petharbor.com/pet.asp?uaid=KING.A584097,"Tukwila Petco 17200 SOUTHCENTER PKWY 100 TUKWILA, WA 98188",Orion,Cat,2 YEARS,Neutered Male,Domestic Shorthair,Brn Tabby,05/02/2019 12:00:00 AM,Received on,21800 SE WAX RD,MAPLE VALLEY,WA,98038,MAPLE VALLEY,47.390776,-122.0502,https://petharbor.com/get_image.asp?RES=Detail&LOCATION=KING&ID=A584097,Image Copyright HLP Inc. 2019,"Received on: 2019-05-02<p/> Found Near: 21800 SE WAX RD, MAPLE VALLEY WA 98038<p/> Description: Brn Tabby Neutered Male Domestic Shorthair Cat<p/> Age: 2 YEARS<p/> Current Location: Tukwila Petco 17200 SOUTHCENTER PKWY 100 TUKWILA, WA 98188<p/>",GREEN
K19-116887,A584139,Regional Animal Services of King County,FOUND,https://petharbor.com/pet.asp?uaid=KING.A584139,"King County Pet Adoption Center 21615 64TH AVE S KENT, WA 98032",Sydney,Dog,2 YEARS,Spayed Female,American Staffordshire / Mix,Brown / White,05/02/2019 12:00:00 AM,Received on,28600 137TH AVE SE,KENT,WA,98042,KENT,,,https://petharbor.com/get_image.asp?RES=Detail&LOCATION=KING&ID=A584139,Image Copyright HLP Inc. 2019,"Received on: 2019-05-02<p/> Found Near: 28600 137TH AVE SE, KENT WA 98042<p/> Description: Brown / White Spayed Female American Staffordshire / Mix Dog<p/> Age: 2 YEARS<p/> Current Location: King County Pet Adoption Center 21615 64TH AVE S KENT, WA 98032<p/>",BLUE
K19-116875,A584098,Regional Animal Services of King County,FOUND,https://petharbor.com/pet.asp?uaid=KING.A584098,"King County Pet Adoption Center 21615 64TH AVE S KENT, WA 98032",Comet,Cat,1 YEAR,Spayed Female,Domestic Shorthair,Black / White,05/02/2019 12:00:00 AM,Received on,3400 S 262ND ST,KENT,WA,98032,KENT,,,https://petharbor.com/get_image.asp?RES=Detail&LOCATION=KING&ID=A584098,Image Copyright HLP Inc. 2019,"Received on: 2019-05-02<p/> Found Near: 3400 S 262ND ST, KENT WA 98032<p/> Description: Black / White Spayed Female Domestic Shorthair Cat<p/> Age: 1 YEAR<p/> Current Location: King County Pet Adoption Center 21615 64TH AVE S KENT, WA 98032<p/>",
K19-116873,A584096,Regional Animal Services of King County,FOUND,https://petharbor.com/pet.asp?uaid=KING.A584096,"King County Pet Adoption Center 21615 64TH AVE S KENT, WA 98032",Nebula,Cat,1 YEAR,Spayed Female,Domestic Shorthair,Tortie,05/02/2019 12:00:00 AM,Received on,8000 SILVA AVE SE,SNOQUALMIE,WA,98155,SNOQUALMIE,,,https://petharbor.com/get_image.asp?RES=Detail&LOCATION=KING&ID=A584096,Image Copyright HLP Inc. 2019,"Received on: 2019-05-02<p/> Found Near: 8000 SILVA AVE SE, SNOQUALMIE WA 98155<p/> Description: Tortie Spayed Female Domestic Shorthair Cat<p/> Age: 1 YEAR<p/> Current Location: King County Pet Adoption Center 21615 64TH AVE S KENT, WA 98032<p/>",
K19-116903,A584184,Regional Animal Services of King County,ADOPTABLE,https://petharbor.com/pet.asp?uaid=KING.A584184,"King County Pet Adoption Center 21615 64TH AVE S KENT, WA 98032",Buckaroo,Cat,11 YEARS,Neutered Male,Domestic Shorthair,Brn Tabby / White,05/03/2019 12:00:00 AM,Received on,,,,,,,,https://petharbor.com/get_image.asp?RES=Detail&LOCATION=KING&ID=A584184,Image Copyright HLP Inc. 2019,"Received on: 2019-05-03<p/> Description: Brn Tabby / White<p/>  Neutered Male Domestic Shorthair Cat<p/> Age: 11 YEARS<p/> Adoption Fee: $30.00<p/> Current Location: King County Pet Adoption Center 21615 64TH AVE S KENT, WA 98032<p/>Hi! My name is Buckaroo and I am available for adoption.<p/><p/>I was brought in by my previous owner on 5/3/19 because they were moving. I lived in a home with another cat. <p/><p/>I am an affectionate lovebug who would be thrilled to cuddle up with you at home!<p/><p/>My caregivers have noticed that I seem to do well with other cats. When meeting cats in a new home, I would do best with a slow introduction.<p/><p/>My personality color is BLUE. I am a gentle and loving cat who likes to take things slow. I may get nervous in new situations, so I am looking for a family who understands that I might need some time to warm up. Once I get to know you, I will be a very devoted friend!<p/><p/>",BLUE
K19-116900,A536164,Regional Animal Services of King County,ADOPTABLE,https://petharbor.com/pet.asp?uaid=KING.A536164,"King County Pet Adoption Center 21615 64TH AVE S KENT, WA 98032",Ella,Dog,4 YEARS,Spayed Female,Labrador Retriever / Australian Shepherd,Chocolate / White,05/03/2019 12:00:00 AM,Received on,,,,,,,,https://petharbor.com/get_image.asp?RES=Detail&LOCATION=KING&ID=A536164,Image Copyright HLP Inc. 2019,"Received on: 2019-05-03<p/> Description: Chocolate / White<p/>  Spayed Female Labrador Retriever / Australian Shepherd Dog<p/> Age: 4 YEARS<p/> Adoption Fee: $200.00<p/> Current Location: King County Pet Adoption Center 21615 64TH AVE S KENT, WA 98032<p/>Hi! My name is Ella and I am available for adoption.<p/><p/>I was brought in by my previous owner on May 3, 2019 because they were moving to an apartment and knew I would not thrive there. I lived in a home with small children. My previous owner described me as outgoing and energetic.<p/><p/>I am a very smart dog! I have shown my caregivers that I already know how to ""sit"".<p/><p/>I am an affectionate lovebug who would be thrilled to cuddle up with you at home!<p/><p/>I am full of energy and I love to play! I tend to calm down more when the people around me stay calm. I do best when I have lots of exercise and something to keep my mind busy.I do have a tendancy to be jumpy so I would do best in a home with children who are okay with that and family members who can help train me to learn my manners!<p/><p/> My caregivers have noticed that I seem to do well with other dogs. When meeting dogs in a new home, I would do best with a slow introduction.<p/><p/><p/>My personality color is RED. I am a spirited dog with a fun-loving personality! I am still working on my manners, so I would do best with a family who is willing to work with me and help me become the best dog I can be!<p/>",RED
K19-116898,A584176,Regional Animal Services of King County,FOUND,https://petharbor.com/pet.asp?uaid=KING.A584176,"King County Pet Adoption Center 21615 64TH AVE S KENT, WA 98032",Bit-Z,Cat,12 YEARS,Spayed Female,Domestic Shorthair,Black,05/03/2019 12:00:00 AM,Received on,24500 64TH AVE S,KENT,WA,98032,KENT,,,https://petharbor.com/get_image.asp?RES=Detail&LOCATION=KING&ID=A584176,Image Copyright HLP Inc. 2019,"Received on: 2019-05-03<p/> Found Near: 24500 64TH AVE S, KENT WA 98032<p/> Description: Black Spayed Female Domestic Shorthair Cat<p/> Age: 12 YEARS<p/> Current Location: King County Pet Adoption Center 21615 64TH AVE S KENT, WA 98032<p/>",BLUE
K19-116924,A584221,Regional Animal Services of King County,ADOPTABLE,https://petharbor.com/pet.asp?uaid=KING.A584221,"King County Pet Adoption Center 21615 64TH AVE S KENT, WA 98032",Ivan,Cat,2 YEARS,Neutered Male,Domestic Shorthair,Black / White,05/04/2019 12:00:00 AM,Received on,,,,,,,,https://petharbor.com/get_image.asp?RES=Detail&LOCATION=KING&ID=A584221,Image Copyright HLP Inc. 2019,"Received on: 2019-05-04<p/> Description: Black / White<p/>  Neutered Male Domestic Shorthair Cat<p/> Age: 2 YEARS<p/> Adoption Fee: $30.00<p/> Current Location: King County Pet Adoption Center 21615 64TH AVE S KENT, WA 98032<p/>Hi! My name is Ivan and I am available for adoption.<p/><p/>I was brought in by a good samaritan on May 4th, 2019].<p/><p/>I'm a very active guy who likes to keep busy! I would love to find a home with an equally active and social family. I love enrichment and I am quite smart, figuring out puzzles with my food is very fun for me! I'm not a big snuggly guy, I like getting attention on my own terms. I can get overstimulated with petting, so please move carefully with me and keep an eye out for signs that I might need a break.<p/><p/>My personality color is RED. I am a spirited cat with a fun-loving personality! I may be sensitive to handling, so I would do best in a home with a cat savvy family who knows when to give me some space.<p/>",RED
K19-116927,A581915,Regional Animal Services of King County,ADOPTABLE,https://petharbor.com/pet.asp?uaid=KING.A581915,"King County Pet Adoption Center 21615 64TH AVE S KENT, WA 98032",Frankie,Cat,1 YEAR 1 MONTH,Spayed Female,Domestic Shorthair,Tortie,05/04/2019 12:00:00 AM,Received on,,,,,,,,https://petharbor.com/get_image.asp?RES=Detail&LOCATION=KING&ID=A581915,Image Copyright HLP Inc. 2019,"Received on: 2019-05-04<p/> Description: Tortie<p/>  Spayed Female Domestic Shorthair Cat<p/> Age: 1 YEAR 1 MONTH<p/> Adoption Fee: $30.00<p/> Current Location: King County Pet Adoption Center 21615 64TH AVE S KENT, WA 98032<p/>Hi! My name is Frankie and I am available for adoption.<p/><p/>I was brought in by a good samaritan on March 30th, 2019.<p/><p/>Notes from my foster home: <p/><p/>""Frankie is a beautiful, shy, tortoiseshell, young kitty - She my take a little bit to warm up to you but once she gets to know you, she loves being near you, getting pets from you and is a big-time purr machine! she likes to hold your hand right where she wants you to pet her. She came in with baby kittens and was a wonderful, nurturing mama to her babies and now deserves a nice, relaxing home to call her own. She is still young herself and likes to chase her feather toy and run after balls. She will make a great sofa companion and prefers to be next to you.""<p/><p/>My personality color is BLUE. I am a gentle and loving cat who likes to take things slow. I may get nervous in new situations, so I am looking for a family who understands that I might need some time to warm up. Once I get to know you, I will be a very devoted friend!<p/><p/><p/>",
K19-116924,A584221,Regional Animal Services of King County,FOUND,https://petharbor.com/pet.asp?uaid=KING.A584221,"King County Pet Adoption Center 21615 64TH AVE S KENT, WA 98032",Ivan,Cat,2 YEARS,Neutered Male,Domestic Shorthair,Black / White,05/04/2019 12:00:00 AM,Received on,18000 NE 99TH CT,REDMOND,WA,98052,REDMOND,,,https://petharbor.com/get_image.asp?RES=Detail&LOCATION=KING&ID=A584221,Image Copyright HLP Inc. 2019,"Received on: 2019-05-04<p/> Found Near: 18000 NE 99TH CT, REDMOND WA 98052<p/> Description: Black / White Neutered Male Domestic Shorthair Cat<p/> Age: 2 YEARS<p/> Current Location: King County Pet Adoption Center 21615 64TH AVE S KENT, WA 98032<p/>",RED
K19-116922,A584220,Regional Animal Services of King County,FOUND,https://kingcounty.gov/depts/regional-animal-services/about-us/overview.aspx,In RASKC Foster Home,,Cat,5 WEEKS,Female,Domestic Shorthair,Gray Tabby,05/04/2019 12:00:00 AM,Received on,39900 SE 53RD ST,SNOQUALMIE,WA,98065,KING COUNTY,,,https://petharbor.com/get_image.asp?RES=Detail&LOCATION=KING&ID=A584220,Image Copyright HLP Inc. 2019,"Received on: 2019-05-04<p/> Found Near: 39900 SE 53RD ST, SNOQUALMIE WA 98065<p/> Description: Gray Tabby Female Domestic Shorthair Cat<p/> Age: 5 WEEKS<p/> Current Location: In RASKC Foster Home <p/>",
K19-116921,A584219,Regional Animal Services of King County,FOUND,https://kingcounty.gov/depts/regional-animal-services/about-us/overview.aspx,In RASKC Foster Home,,Cat,5 WEEKS,Female,Domestic Shorthair,Gray Tabby,05/04/2019 12:00:00 AM,Received on,39900 SE 53RD ST,SNOQUALMIE,WA,98065,KING COUNTY,,,https://petharbor.com/get_image.asp?RES=Detail&LOCATION=KING&ID=A584219,Image Copyright HLP Inc. 2019,"Received on: 2019-05-04<p/> Found Near: 39900 SE 53RD ST, SNOQUALMIE WA 98065<p/> Description: Gray Tabby Female Domestic Shorthair Cat<p/> Age: 5 WEEKS<p/> Current Location: In RASKC Foster Home <p/>",
K19-116920,A584218,Regional Animal Services of King County,FOUND,https://kingcounty.gov/depts/regional-animal-services/about-us/overview.aspx,In RASKC Foster Home,,Cat,5 WEEKS,Female,Domestic Shorthair,Gray Tabby,05/04/2019 12:00:00 AM,Received on,39900 SE 53RD ST,SNOQUALMIE,WA,98065,KING COUNTY,,,https://petharbor.com/get_image.asp?RES=Detail&LOCATION=KING&ID=A584218,Image Copyright HLP Inc. 2019,"Received on: 2019-05-04<p/> Found Near: 39900 SE 53RD ST, SNOQUALMIE WA 98065<p/> Description: Gray Tabby Female Domestic Shorthair Cat<p/> Age: 5 WEEKS<p/> Current Location: In RASKC Foster Home <p/>",
K19-116919,A584217,Regional Animal Services of King County,FOUND,https://kingcounty.gov/depts/regional-animal-services/about-us/overview.aspx,In RASKC Foster Home,,Cat,5 WEEKS,Female,Domestic Shorthair,Gray Tabby,05/04/2019 12:00:00 AM,Received on,39900 SE 53RD ST,SNOQUALMIE,WA,98065,KING COUNTY,,,https://petharbor.com/get_image.asp?RES=Detail&LOCATION=KING&ID=A584217,Image Copyright HLP Inc. 2019,"Received on: 2019-05-04<p/> Found Near: 39900 SE 53RD ST, SNOQUALMIE WA 98065<p/> Description: Gray Tabby Female Domestic Shorthair Cat<p/> Age: 5 WEEKS<p/> Current Location: In RASKC Foster Home <p/>",
K19-116926,A584222,Regional Animal Services of King County,FOUND,https://kingcounty.gov/depts/regional-animal-services/about-us/overview.aspx,,,Dead Cat,4 YEARS,Unaltered,Domestic Shorthair,Brn Tabby,05/04/2019 12:00:00 AM,Received on,6400 S 236TH PL,KENT,WA,98032,KENT,,,,Image Copyright HLP Inc. 2019,"Received on: 2019-05-04<p/> Found Near: 6400 S 236TH PL, KENT WA 98032<p/> Description: Brn Tabby Unaltered Domestic Shorthair Cat<p/> Age: 4 YEARS<p/>",
K19-116949,A584270,Regional Animal Services of King County,ADOPTABLE,https://petharbor.com/pet.asp?uaid=KING.A584270,"King County Pet Adoption Center 21615 64TH AVE S KENT, WA 98032",Huckleberry,Cat,9 WEEKS,Neutered Male,Domestic Shorthair,Black / White,05/05/2019 12:00:00 AM,Received on,,,,,,,,https://petharbor.com/get_image.asp?RES=Detail&LOCATION=KING&ID=A584270,Image Copyright HLP Inc. 2019,"Received on: 2019-05-05<p/> Description: Black / White<p/>  Neutered Male Domestic Shorthair Cat<p/> Age: 9 WEEKS<p/> Adoption Fee: $30.00<p/> Current Location: King County Pet Adoption Center 21615 64TH AVE S KENT, WA 98032<p/>Hi! My name is Huckleberry and I am available for adoption.<p/><p/>I was brought in by a good samaritan on May 5th, 2019.<p/><p/>Hi there, I'm what you would call an undersocialized kitten. It doesn't mean anything bad it just means when I was wee little one, I was not taught about how nice and awesome people can be to me. I'm very scared at first but once you take the time to show me I can trust you, I will melt in your arms. Although, I'm a fearful kitty, I actually really love to snuggle and purr! I would love to go to a home with one of my siblings or with a younger, confident kitty friend! <p/><p/>My personality color is BLUE. I am a gentle and loving cat who likes to take things slow. I may get nervous in new situations, so I am looking for a family who understands that I might need some time to warm up. Once I get to know you, I will be a very devoted friend!<p/>",BLUE
K19-116941,A528700,Regional Animal Services of King County,ADOPTABLE,https://petharbor.com/pet.asp?uaid=KING.A528700,"Kirkland Petco 12040 NE 85TH ST KIRKLAND, WA 98033",Angel,Cat,2 YEARS,Spayed Female,Domestic Mediumhair,Black / White,05/05/2019 12:00:00 AM,Received on,12040 NE 85TH ST,KIRKLAND,WA,98033,KIRKLAND,47.680519,-122.179195,https://petharbor.com/get_image.asp?RES=Detail&LOCATION=KING&ID=A528700,Image Copyright HLP Inc. 2019,"Received on: 2019-05-05<p/> Description: Black / White<p/>  Spayed Female Domestic Mediumhair Cat<p/> Age: 2 YEARS<p/> Adoption Fee: $30.00<p/> Current Location: Kirkland Petco 12040 NE 85TH ST KIRKLAND, WA 98033<p/>Hi! My name is Angel and I am available for adoption. I was brought in by my previous owner on May 5, 2019 because they were moving. I lived in a home with small dogs and children as young as 7 years. My previous owner described me as shy and cuddly<p/><p/>I am an affectionate lovebug who would be thrilled to cuddle up with you at home!<p/><p/>Because of my shy nature, I would do best in a calm, quiet home.<p/><p/>My personality color is BLUE. I am a gentle and loving cat who likes to take things slow. I may get nervous in new situations, so I am looking for a family who understands that I might need some time to warm up. Once I get to know you, I will be a very devoted friend!<p/><p/><p/>",
K19-116947,A584268,Regional Animal Services of King County,ADOPTABLE,https://petharbor.com/pet.asp?uaid=KING.A584268,"King County Pet Adoption Center 21615 64TH AVE S KENT, WA 98032",Strawberry,Cat,1 YEAR,Spayed Female,Domestic Shorthair,Brn Tabby,05/05/2019 12:00:00 AM,Received on,,,,,,,,https://petharbor.com/get_image.asp?RES=Detail&LOCATION=KING&ID=A584268,Image Copyright HLP Inc. 2019,"Received on: 2019-05-05<p/> Description: Brn Tabby<p/>  Spayed Female Domestic Shorthair Cat<p/> Age: 1 YEAR<p/> Adoption Fee: $30.00<p/> Current Location: King County Pet Adoption Center 21615 64TH AVE S KENT, WA 98032<p/>Hi! My name is Strawberry and I am available for adoption.<p/><p/>I was brought in by a good samaritan on May 5th, 2019.<p/><p/>I'm a very reserved lady who is looking for a home that I can call my own and do my thing in. Although I do enjoy the company of humans, I am just not a big time snuggler. Before coming into the shelter I hung out for a couple months at my finders house and got to hang out with a lot of teen children and new people and I seemed to enjoy that. <p/><p/>My personality color is BLUE. I am a gentle and loving cat who likes to take things slow. I may get nervous in new situations, so I am looking for a family who understands that I might need some time to warm up. Once I get to know you, I will be a very devoted friend!<p/><p/>",BLUE
K19-116932,A584257,Regional Animal Services of King County,FOUND,https://kingcounty.gov/depts/regional-animal-services/about-us/overview.aspx,,,Dead Bird,NO AGE,Unaltered,Crow,Black,05/05/2019 12:00:00 AM,Received on,11700 157TH AVE NE,REDMOND,WA,98052,REDMOND,,,,Image Copyright HLP Inc. 2019,"Received on: 2019-05-05<p/> Found Near: 11700 157TH AVE NE, REDMOND WA 98052<p/> Description: Black Unaltered Crow Bird<p/> Age: NO AGE<p/>",
K19-116933,A584258,Regional Animal Services of King County,FOUND,https://petharbor.com/pet.asp?uaid=KING.A584258,"King County Pet Adoption Center 21615 64TH AVE S KENT, WA 98032",,Dog,10 YEARS,Spayed Female,Jack Russell Terrier,Tricolor,05/05/2019 12:00:00 AM,Received on,15300 SE 307TH ST,KENT,WA,98042,KING COUNTY,,,https://petharbor.com/get_image.asp?RES=Detail&LOCATION=KING&ID=A584258,Image Copyright HLP Inc. 2019,"Received on: 2019-05-05<p/> Found Near: 15300 SE 307TH ST, KENT WA 98042<p/> Description: Tricolor Spayed Female Jack Russell Terrier Dog<p/> Age: 10 YEARS<p/> Current Location: King County Pet Adoption Center 21615 64TH AVE S KENT, WA 98032<p/>",
K19-116936,A584261,Regional Animal Services of King County,FOUND,https://petharbor.com/pet.asp?uaid=KING.A584261,"King County Pet Adoption Center 21615 64TH AVE S KENT, WA 98032",Pulsar,Cat,8 MONTHS,Neutered Male,Domestic Mediumhair,Gray / White,05/05/2019 12:00:00 AM,Received on,3400 S 262ND ST,KENT,WA,98032,KENT,,,https://petharbor.com/get_image.asp?RES=Detail&LOCATION=KING&ID=A584261,Image Copyright HLP Inc. 2019,"Received on: 2019-05-05<p/> Found Near: 3400 S 262ND ST, KENT WA 98032<p/> Description: Gray / White Neutered Male Domestic Mediumhair Cat<p/> Age: 8 MONTHS<p/> Current Location: King County Pet Adoption Center 21615 64TH AVE S KENT, WA 98032<p/>",
K19-116949,A584270,Regional Animal Services of King County,FOUND,https://petharbor.com/pet.asp?uaid=KING.A584270,"King County Pet Adoption Center 21615 64TH AVE S KENT, WA 98032",Huckleberry,Cat,9 WEEKS,Neutered Male,Domestic Shorthair,Black / White,05/05/2019 12:00:00 AM,Received on,34700 54TH AVE S,AUBURN,WA,98001,KING COUNTY,,,https://petharbor.com/get_image.asp?RES=Detail&LOCATION=KING&ID=A584270,Image Copyright HLP Inc. 2019,"Received on: 2019-05-05<p/> Found Near: 34700 54TH AVE S, AUBURN WA 98001<p/> Description: Black / White Neutered Male Domestic Shorthair Cat<p/> Age: 9 WEEKS<p/> Current Location: King County Pet Adoption Center 21615 64TH AVE S KENT, WA 98032<p/>",BLUE
K19-116947,A584268,Regional Animal Services of King County,FOUND,https://petharbor.com/pet.asp?uaid=KING.A584268,"King County Pet Adoption Center 21615 64TH AVE S KENT, WA 98032",Strawberry,Cat,1 YEAR,Spayed Female,Domestic Shorthair,Brn Tabby,05/05/2019 12:00:00 AM,Received on,34700 54TH AVE S,AUBURN,WA,98001,KING COUNTY,,,https://petharbor.com/get_image.asp?RES=Detail&LOCATION=KING&ID=A584268,Image Copyright HLP Inc. 2019,"Received on: 2019-05-05<p/> Found Near: 34700 54TH AVE S, AUBURN WA 98001<p/> Description: Brn Tabby Spayed Female Domestic Shorthair Cat<p/> Age: 1 YEAR<p/> Current Location: King County Pet Adoption Center 21615 64TH AVE S KENT, WA 98032<p/>",BLUE
K19-116942,A584265,Regional Animal Services of King County,FOUND,https://petharbor.com/pet.asp?uaid=KING.A584265,"King County Pet Adoption Center 21615 64TH AVE S KENT, WA 98032",Gunner,Dog,NO AGE,Male,Chihuahua - Smooth Coated,Tan,05/05/2019 12:00:00 AM,Received on,400 SOUTH FORK AVE SW,NORTH BEND,WA,98045,NORTH BEND,,,https://petharbor.com/get_image.asp?RES=Detail&LOCATION=KING&ID=A584265,Image Copyright HLP Inc. 2019,"Received on: 2019-05-05<p/> Found Near: 400 SOUTH FORK AVE SW, NORTH BEND WA 98045<p/> Description: Tan Male Chihuahua - Smooth Coated Dog<p/> Age: NO AGE<p/> Current Location: King County Pet Adoption Center 21615 64TH AVE S KENT, WA 98032<p/>",
